Пена;Таисия;Игоревич;Эмма Изумрудного подполья;1851;108
Потемкин;Михаил;Талантбековна;Обломов товарища Зеленых близ шкаф;2017;41
Николаев;Роман;Витальевич;Чарли Тома во чудес Ливингстон;1910;346
Шлянов;Евгения;Федорович;Борис принц галактике;1878;400
Гусейнли;Данил;Николаевич;Джейн глазами одиночества не штурман;1881;249
Дьячкова;Малик;Андреевич;Возвращение арка (В и 44-го);1945;476
Алексанов;Виталий;Алексеевна;Пётр Пух имени фабрика;1923;903
Шестопалов;Дария;Григорьевич;Тарас Бриджит К кукушки перемен;1844;595
Кузнецова;Дамир;Валерьевич;Дворянское Шарлотты гигантский мир;1898;659
Романовский;Юлия;Александровна;Кавказский зори Современный колокол;1975;788
Власенко;Анна;Ришатович;Молитва мушкетера и его;1986;962
Померанцев;Роберт;Андреевич;Республика паруса Зеленых Джонатан огня;2001;588
Галиева;Александр;Федорович;Поющие и мир холеры Ливингстон;1917;925
Сорокин;Айдана;Александровна;Властелин Поттер мертвые платяной;1886;497
Лилина;Эльдар;Максимовна;Три служанки по холеры;1902;357
Темурбекова;Илья;Сергеевич;Благие знамения дети персик;1935;388
Садофьев;Булат;Максимовна;Тихий капитана во и Диканьки;1979;577
Пена;Анастасия;Андреевич;Медный Белкина Джонс;1891;864
Николаев;Илья;Георгиевна;Сто Шакала время холеры;2005;231
Зырянов;Юлия;Сергеевич;Большие стульев времени его;1950;166
Дегтярев;Дарья;Витальевич;Анна морей: одиночества;1942;282
Тихонов;Марк;Дмитриевич;Село Каренина звонит его;1888;246
Теслюк;Никита;Вадимович;Ким принц фронте философский;1895;185
Садофьев;Николай;Батырович;Стража! мух Зеленых кукушки Азкабана;1909;885
Тихонов;Алексей;Романович;Американский полуночи К;1971;578
Александров;Эдуард;Ильдарович;Преступление Изумрудного лье Фаренгейту;1857;42
Чинилов;Юлия;Романович;Таинственный Поттер море персик;1983;687
Исакова;Евгения;Андреевна;Поющие обелиск К;2016;705
Попцова;Виктория;Евгеньевна;Рассказ полуночи Маргарита оружию!;1851;95
Любимов;Василий;Игоревна;Мрачный Монте-Кристо Оуэне и;1877;474
Гаянов;Гулабру;Константинович;Игрок знамения Финна его водой;1983;507
Быковский;Яков;Алексеевна;О Дик Стране;1915;161
Сорокин;Артём;Ришатович;Лето западном Маргарита клуба;2002;359
Чернов;Александр;Вячеславович;Приключения из Стране и;1867;578
Новиков;Эльдар;Андреевич;Земля всадник Современный;1899;995
Чернов;Илья;Геннадьевна;Доктор тьмы мир;1979;694
Кирьянов;Полина;Валерьевич;Доводы Сергий Маргарита без;1917;495
Савельичев;Даня;Дмитриевна;Грозовой Господне время людях;1841;195
Шарова;Валерия;Эдуардовна;Алые лёгкость гигантский Том камень;1890;355
Бурцев;Иван;Константинович;Собака и оскорблённые;1886;884
Коште;Елена;Федорович;Два рассказы ивах без Азкабана;1958;269
Шестопалов;Наталия;Николаевич;К Иден ума грядущего добрый;1855;812
Алексанов;Елена;Андреевич;Человек-амфибия в Холмса рая камень;1860;954
Алексанов;Анна;Валерьевна;Алиса и и мир;1865;391
Галкин;Михаил;Батырович;Франкенштейн, принц 6 холеры обитатели;1895;713
Сорокин;Анна;Эдуардовна;О миля города и считая;1867;327
Шевцев;Георгий;Васильевна;БДВ, ветром имени;1873;828
Торжков;Очир;Алексеевич;Тёмные и дети чудес;1949;587
Кирьянов;Игорь;Максимович;Пётр Поттер границей Мини;1931;48
Немна;Наталия;Алексеевна;Ким над Гарпа;1842;271
Бекетова;Владислав;Ильдарович;Стража! Эйр Лис кукушки шкаф;1847;26
Кирьянов;Алексей;Константинович;Портрет птиц подполья Фаренгейту;1972;66
Кирьянов;Яна;Бакытбековна;Моби ком мукам не;1979;281
Строкин;Виталий;Александрович;Белый души наказание дома комната;2021;769
Москаленко;Анастасия;Владимирович;Портрет принц оскорблённые;2016;875
Кудрявцева;Екатерина;Васильевич;Вечера и Пиквикского Джонатан;1942;448
Фроловичев;Никита;Равкатовна;Двадцать Онегин Командир его перемен;1972;493
Осипов;Екатерина;Михайловна;Граф капитана 6 колокол;1855;821
Хмелев;Павел;Павлович;Гроздья по и городах;1960;476
Куликова;Артем;Владимирович;Трое колец границей без штурман;1893;991
Шевцев;Михаил;Карамалиева;Медный Фаул богом и;1946;458
Хахарова;Илья;Игоревна;Морфий перевал Форсайтах Мезонинов считая;1865;43
Спирин;Роберт;Игоревич;Властелин рассудка Холмса августе считая;1855;683
Хангильдин;Магомед;Алексеевна;Дядя Клык и и;1979;726
Антонов;Марк;Николаевич;Повелитель былого Смерти Кубок 44-го);1953;788
Васильева;Георгий;Даниловна;Повесть Живаго наказание его комната;1930;845
Рубайко;Валерия;Игоревич;Мастер перевал К без;2010;344
Блюм;Таисия;Андреевич;Любовь на Брайдсхед Фаренгейту;1916;964
Спирин;Гордей;Разилевна;Сто сад здесь философский;1868;247
Марков;Юлия;Сергеевич;1984 ветром города персик;1945;398
Аношин;Артём;Евгеньевна;Хайди и ивах рая добрый;1878;372
Никитина;Данил;Олеговна;Морфий Дориана 6 кукушки огня;1877;647
Пена;Юлия;Александрович;Мор, ШКИД Командир грядущего;1903;224
Дегтярев;Виктор;Равкатовна;Республика тщеславия звонит без;1898;600
Безель;Александр;Юрьевич;Алхимик от море;1959;798
Баринова;Роберт;Сергеевич;Обитатели холмов города платяной;2005;206
Безель;Александр;Гумаровна;Гарри над предубеждение без;1905;887
Швырев;Алиса;Борисович;Подросток Крузо гнездом рая Азкабана;1925;535
Быковский;Михаил;Дмитриевич;Рассказ по любовники и;1905;667
Куликова;Максим;Сергеевна;Пение начала во Кубок;1855;38
Козырева;Владислав;Дмитриевич;Дворянское из и;2001;971
Черноиванова;Илья;Алексеевна;Двадцать и и оружию! перемен;1996;954
Салдусов;Мирра;Разилевна;Корабельные игле города Тайная комната;1857;348
Бикушев;Константин;Игоревна;Чайка лет наказание платяной;1899;837
Немна;Софья;Сергеевич;Алиса человека звонит оружию!;1952;376
Новиков;Данил;Геннадьевна;Пётр оружию! терновнике;1882;463
Кузнецова;Элеонора;Вадимович;На дороге имени грядущего;2003;479
Люкшин;Владимир;Григорьевич;Драма и новый кукушки 44-го);1923;163
Александров;Станислав;Альбертович;Божество в лодке, фабрика;1859;104
Куликова;Михаил;Равкатовна;451 Санникова наказание Кубок Ливингстон;2010;363
Шестопалов;Лука;Георгиевич;Вещие птиц шоколадная;2013;336
Сайфуллина;Наталия;Дмитриевич;Белая об море близ шкаф;1919;381
Кузнецова;Роман;Константинович;Маленькие из гнездом чудес камень;1870;877
Хайрутдинова;Дмитрий;Георгиевна;Бесы души мир городах;1861;543
Куликова;Николай;Ильдарович;Триумфальная оружию! Командир клуба камень;2010;441
Аношин;Данил;Борисович;На дочка двух Кубок перемен;1842;499
Дегтярев;Долума;Васильевич;Пиковая дом и и комната;1902;531
Бикушев;Иван;Руслановна;Горе на мукам мир перемен;1880;42
Зайнутдинова;Алмаз;Эльханович;Мрачный Дик богом без;1925;951
Прокшин;Дария;Вадимович;Приключения Поттер мир близ считая;1902;631
Петров;Мария;Владимирович;Гордость за и людях;1930;279
Васильева;Алексей;Романович;Портрет новости Маргарита;2019;858
Шпак;Эльфат;Александрович;Остров Шерлока ивах Кубок Диканьки;1854;465
Галиева;Арина;Алексеевич;Севастопольские градус чердаке;1894;322
Псурцев;Марк;Михайловна;Франкенштейн, из одиночества д’Эрбервиллей;1994;799
Бурцев;Дмитрий;Ришатович;Сыновья или богом без считая;1983;691
Псурцев;Анастасия;Константинович;Триумфальная от подполья фабрика;1915;101
Панов;Евгения;Романович;Трудно колец Грея тихие обратно;1966;951
Теслюк;Станислав;Васильевич;Иван боги лье Тайная Диканьки;1988;121
Перетятько;Лука;Владимирович;Мор, знамения Большой и Ливингстон;1866;954
Кирьянов;Егор;Алексеевич;К Клык охоте;1939;49
Старшинов;Иван;Сергеевич;Хаджи-Мурат дочка границей;1943;181
Савельичев;Иван;Викторовна;Медный колдунья лье не;1926;261
Осипов;Юлия;Михайловна;Волхв пропастью Твиста колокол;2016;559
Темурбекова;Георгий;Андреевич;Грозовой Незаметный время кукушки;2017;771
Харисова;Карам;Геннадьевна;Большие Гекльберри Гарпа платяной;1936;198
Бездольный;Лука;Георгиевич;Аня пересмешника мир мир Диканьки;1965;646
Егорова;София;Олеговна;Цвет миров хуторе городах;1864;432
Хайрутдинова;Андрей;Алексеевна;Повести Живаго здесь;1852;824
Волох;Данил;Константинович;Доктор на гнездом;1923;384
Гребенкин;Арина;Ильдарович;Война глазами Маргарита Джонатан водой;1886;494
Салдусов;Бегимай;Равкатовна;Моби Эйр Людмила дома Диканьки;1891;271
Антонов;Михаил;Станиславовна;Божество гнева наказание Кубок обратно;1959;378
Панов;Яна;Рамильевич;Детство. в подполья близ;1853;736
Шкляев;Артемий;Талантбековна;Палата перевал наказание не;1950;909
Ефимов;Алексей;Альбертович;Солярис о любовники холеры;1850;196
Дегтярев;Михаил;Геннадьевна;Обломов миля Лис кукушки;1952;50
Немна;Кристина;Тамазович;Дневник над Туда рая;2014;634
Москаленко;Иван;Васильевна;Волхв сад здесь Кубок Ливингстон;2005;101
Егорова;Михаил;Эдуардовна;Цвет Эйр времени и;1851;701
Таранченко;Артем;Александровна;Доктор глазами от и;1989;409
Любимов;Арина;Артемович;Три глазами подполья ржи;1878;344
Кирьянов;Николай;Георгиевич;Бег всадник новый Мезонинов шкаф;1909;998
Глазачев;Илья;Анатольевна;Благие волшебства фронте;1953;306
Шестопалов;Арина;Константинович;Три гнева времени кукушки перемен;1852;937
Сильвентойнен;Сергей;Васильевич;Горменгаст арка Людмила оружию! обитатели;1912;914
Баринова;Галина;Викторовна;Отцы мистер гнездом Тайная Азкабана;1878;919
Козырева;Лада;Дмитриевич;Граф в врача клуба;1897;63
Немна;Роберт;Владимировна;Морфий знамения Финна близ;2020;903
Москаленко;Дмитрий;Игоревич;Пролетая в подполья узник;1913;205
Кудрявцева;Таисия;Георгиевна;На Иден Грея ржи штурман собаки;1842;879
Муханов;Роберт;Владимирович;Девчонки двор Гарпа тихие водой;2010;706
Бурцев;Карам;Алексеевич;Осиная гнева и колокол;1869;684
Зайнутдинова;Эльфат;Андреевич;Дюна и время;1935;831
Харисова;Владимир;Александровна;Чарли Монте-Кристо терновнике;1933;125
Феодосьев;Иван;Ильдарович;Бег о рода узник камень;1866;995
Клянчин;Арина;Максимовна;Записки ком Маргарита и;1914;923
Дегтярев;Максим;Андреевич;Ярмарка и Оуэне платяной;1876;609
Санджиев;Галина;Валерьевна;Солярис оружию! Твиста без;1954;989
Санджиев;Данил;Алексеевна;Божество жнец и Том;2019;756
Новиков;Арина;Михайловна;Корабельные на и под;1927;912
Усманов;Яков;Викторовна;Чайка Карамазовы Твиста без 44-го);1893;245
Нуртдинов;Никита;Станиславович;Драма мышах Брайдсхед Джонатан Ливингстон;1890;678
Алексанов;Виталий;Юрьевич;Анна по Людмила фабрика;1910;445
Чинилов;Никита;Юрьевич;Гарри жнец фронте его;1996;598
Александров;София;Сергеевна;Пляж полуночи лье Фаренгейту;2013;173
Шпак;Егор;Сергеевич;Приключения Оливера мир колокол обратно;1996;77
Торжков;Иван;Олегович;Трудно холмов ума;1876;91
Прокопенко;Долума;Михайловна;Унесённые рассудка и августе 44-го);1890;173
Амирханов;Алексей;Николаевна;Джеймс Тома и без;1894;425
Прокшин;Василий;Андреевич;Над Парижской предубеждение городах перемен;1906;318
Егорова;Анна;Константинович;Дядя рассудка здесь без;1942;110
Базоева;Дарья;Андреевич;Артемис или и людях обратно;1945;849
Лукашева;Василий;Михайлович;Хоббит, и и без;1996;705
Кудрявцева;Андрей;Гумаровна;Гарри Парижской море оружию! камень;1917;755
Егорова;Артемий;Игоревич;Ведьмы над двух чудес шкаф;1917;581
Милаева;Максим;Юрьевич;Земля или времени фабрика огня;1982;63
Чинилов;Артемий;Михайлович;Ведьмы служанки Грея Фаренгейту;1939;651
Жмурин;Анастасия;Павлович;Сто истины фронте Прометей;2010;486
Феодосьев;Владислав;Айдаровна;Ребекка Поттер одиночества философский обитатели;1975;465
Феодосьев;Алексей;Николаевич;День Поттер двух д’Эрбервиллей обитатели;2001;406
Старшинов;Николай;Валерьевич;Рождественская нашего времени;1884;510
Чинилов;Владислав;Геннадьевна;Обломов и терновнике не;1889;398
Батурин;Владислав;Андреевич;Божество Баскервилей и его;1849;715
Потемкин;Станислав;Алексеевна;Маленькие Парижской новый философский штурман;1889;332
Карухов;Артём;Константинович;Трое Шарлотты мукам Кубок;1850;712
Швырев;Илья;Григорьевич;Война оружию! подполья холеры;2009;367
Спирин;Марк;Васильевич;Трое или ума людях;1915;457
Гаянов;Даниил;Александрович;Роковая капитана и ржи огня;1946;286
Мансуров;Кира;Сергеевич;Драма Дун Мёртвого Кубок;1870;939
Лукашева;Георгий;Дмитриевич;Руслан пропастью Командир персик камень;1879;194
Бекетова;Элина;Александровна;Три сад наказание Прометей;1849;577
Романовский;София;Алексеевич;Маленькие из одиночества платяной;1898;758
Псурцев;Очир;Вячеславович;Анна охотника Пиквикского Том перемен;1919;513
Ефимов;Даниил;Рамильевич;Приключения Фаул фронте Том;1930;622
Селиванова;Виктория;Михайлович;Старик в бытия грядущего штурман;1850;792
Пена;Лада;Федорович;Ведьмы миров Оуэне;2009;516
Кудрявцева;София;Вячеславович;Обитатели человека фронте под;1977;469
Кирьянов;Артемий;Владимировна;Левша ветром наказание близ;2015;285
Санджиев;Николай;Георгиевич;Отец и Людмила Мезонинов шкаф;1966;114
Толмачева;Максим;Айдаровна;На и наказание дома штурман;1968;254
Словеснов;Дарья;Георгиевна;Преступление арка К;1979;617
Лукашева;Регина;Сергеевна;О или во ржи перемен;1957;315
Шестопалов;Сергей;Сергеевич;Доктор жнец лье не;1957;551
Алексанов;Очир;Бакытбековна;Левша Первый гигантский Том;1849;340
Егорова;Артем;Юрьевич;Гарри Поттер фронте д’Эрбервиллей;2018;971
Усманов;Наталия;Сергеевич;Отец Белкина Джонс Том обитатели;1952;307
Шевцев;Алексей;Рафиковна;Тэсс Белкина и философский;1979;862
Бескровная;Алексей;Анатольевна;Пляж Бульба море оружию!;1920;146
Бикушев;Магомед;Бакытбековна;Тарас юного и платяной;1890;841
Куулар;Арина;Алексеевна;Война во время августе;1993;858
Гребнев;Павел;Васильевна;Пятый рассказы и;1963;693
Померанцев;Мария;Андреевич;Тёмные Бриджит и тихие шкаф;1865;886
Васильева;Анастасия;Рамильевич;Двенадцать женщины любовники без Диканьки;1969;603
Козырева;Камилла;Георгиевич;Триумфальная Софии ума мир добрый;1992;656
Колесников;Алексей;Равкатовна;Винни стульев;1907;520
Бекетова;Алексей;Олеговна;Дракула Живаго и философский;1908;390
Андреев;Николай;Николаевич;По миля Смерти кукушки Азкабана;1945;455
Гусейнли;Андрей;Анатольевна;Мёртвые лет дети ржи;1960;463
Спирин;Юлия;Даниловна;Алхимик принц Оуэне и;1857;388
Зырянов;Таисия;Валерьевна;Рассказ Изумрудного допоздна мир;1944;393
Пучко;Иван;Вячеславович;Бедные пропастью Зеленых Том;1896;321
Бездольный;Михаил;Геннадьевна;Робинзон и границей Джонатан;1973;491
Харисова;Илья;Вячеславовна;Драма из и;1918;490
Пинаев;Вадим;Романович;1984 новости и Мини считая великан;1905;442
Олефир;Анастасия;Бакытбековна;Лорна западном охоте без;1893;740
Осипов;Никита;Денисович;Автостопом музыка Мёртвого близ;1999;564
Галкин;Андрей;Максимовна;Мир Софии и и;1902;633
Коряков;Полина;Владимировна;Записки ШКИД Современный фабрика;1939;368
Молодых;Михаил;Андреевна;Моби холмов Зеленых ржи;1934;477
Солдатов;Артем;Георгиевич;Тарас в Людмила чудес;1983;137
Нечаев;Дарья;Эдуардовна;Сто птиц Командир;1885;730
Старшинов;Егор;Андреевич;Имя из имени кукушки;1968;465
Зайнутдинова;Дарья;Эдуардовна;Гарри ШКИД галактике узник шкаф;1964;966
Батурин;Алиса;Игоревич;Повесть гнездо Юность людях;1942;467
Шлянов;Дарья;Вячеславович;Трое западном одиночества не перемен;1944;20
Антонов;Анна;Ильинична;Мартин западном мир без;2002;434
Девяткин;Максим;Максимовна;Аня Дун Гарпа;1842;521
Теслюк;Владислав;Руслановна;Эмма знамения охоте грядущего;1870;330
Васильев;Евгения;Владимирович;Приключения знамения терновнике и;1984;844
Амирханов;Александр;Руслановна;Дракула и мир его;1986;391
Рубайко;Галина;Сергеевич;Девчонки времени море;1840;548
Коште;Артём;Юрьевич;Живые Баскервилей Твиста;1912;107
Бескровная;Булат;Васильевич;Поющие Сергий Юность и Азкабана;1896;271
