Егорова;Марк;Васильевич;Сыновья Крузо Финна фабрика;1970;250
Гребенкин;Иван;Гумаровна;Евгений надежды Твиста;1919;255
Власенко;Карам;Олеговна;Крестный триффидов К людях;2013;173
Балинова;Марк;Сергеевич;Лев, Крузо Сойера платяной;2012;654
Масликов;Алексей;Анатольевна;На о гнездом Мини;1966;643
Гусейнли;Юлия;Гумаровна;Сёгун ученик чердаке чудес;1840;190
Копытин;Лука;Ильсеярович;Большие Санникова Грея;1897;912
Пена;Дмитрий;Викторовна;Пятый Санникова фронте;1884;432
Васильева;Андрей;Витальевич;Властелин из Зеленых ржи 44-го);1900;917
Лилина;Мария;Витальевич;Горменгаст и одиночества дома штурман собаки;2020;304
Гафурова;Анастасия;Юрьевич;Крестный ком Джонс фабрика Диканьки;1993;164
Куликова;Артём;Петрович;Тихий Белкина Брайдсхед;1905;439
Гаянов;Кирилл;Равкатовна;Двадцать сестрички лодке, мир;1896;971
Сайфуллина;Яков;Георгиевич;Мартин Эйр терновнике колокол Диканьки;1866;928
Бурцев;Даня;Гаряевич;На и во Фаренгейту;1852;78
Борисова;Андрей;Вадимович;Портрет зори Лис и;1927;859
Хайрутдинова;Михаил;Игоревич;Ревизор зори лье философский;1877;977
Чертова;Малик;Эдуардовна;Автостопом рассудка Брайдсхед Джонатан;1886;78
Базоева;Максим;Александрович;Ярмарка сердце Холмса августе;1900;665
Девяткин;Данил;Дмитриевна;Лолита Монте-Кристо и холеры;1958;630
Сабитов;Юлия;Сергеевич;Лев, из терновнике Том камень;1880;323
Ткаченко;Александр;Олегович;Три гейши времени платяной;1882;960
Зырянов;Андрей;Марсовна;Божество Ваня Холмса кукушки;1981;973
Темурбекова;Елена;Андреевич;Холодный Крузо Туда персик;1891;55
Джинчарадзе;Владимир;Федорович;Мемуары песнь Современный Фаренгейту;1855;787
Кузнецова;Александр;Ильдарович;Мартин принц дети чудес шкаф;1986;202
Гаянов;Мирра;Николаевич;Граф и лодке, кукушки;2016;691
Торжков;Дарья;Владимирович;Доктор ночи, время мир;2010;569
Бескровная;Александр;Васильевич;Момент Шакала Мёртвого грядущего;2005;137
Дегтярев;Константин;Александровна;Автостопом стража (В клуба;1874;538
Алексанов;Карам;Евгеньевна;Отверженные в и;1985;983
Клянчин;Арина;Рамильевич;Американский мистер Современный;1954;153
Борисова;Григорий;Витальевич;Тихий Онегин мир;1864;212
Милаева;Анна;Ильдарович;Приключения ночи, дети людях;1989;664
Словеснов;Артём;Алексеевич;Противостояние пропастью Мёртвого грядущего Ливингстон;1895;36
Чертова;Виктор;Алексеевич;Зеленая во Оуэне;1927;539
Торжков;Владимир;Равкатовна;Драма Бульба Юность Мезонинов перемен;1953;284
Волох;Гордей;Александрович;Портрет или и Джонатан Ливингстон;2007;774
Нуртдинов;Александр;Разилевна;Приключения полуночи Форсайтах;2009;179
Минубаев;Георгий;Айдаровна;Иван юного Форсайтах Том;1963;986
Шишкин;Галина;Павлович;Записки музыка фронте;1864;953
Зайнутдинова;Владислав;Ильдарович;Чайка востоку границей без;2010;678
Старшинов;Элеонора;Станиславовна;Крестный стража Маргарита фабрика;1935;281
Собко;Магомед;Равкатовна;Ужастики психопат 6 Джонатан добрый;1967;848
Панов;Георгий;Александровна;Старик или;1853;998
Егорова;Дарья;Владимирович;Уловка-22 мистер ивах чудес;1866;841
Исакова;Юлия;Владимировна;Гарри дивный границей оружию! перемен;1897;857
Иванова;Долума;Александрович;Столпы Копперфильд Туда тихие;1997;986
Баринов;Эльдар;Николаевич;Искупление птиц охоте колокол;1927;491
Хахарова;Илья;Федорович;Сто реки море фабрика обитатели;1960;113
Зырянов;Малик;Денисович;Хозяин Каренина шоколадная и;1893;265
Амирханов;Максим;Александровна;Сто в Твиста городах;1926;839
Савченко;Евгений;Сергеевна;Двадцать записки имени августе водой;1905;324
Лилина;Арина;Алексеевич;Спокойной отец мертвые людях штурман;1856;894
Девяткин;Валерия;Олеговна;Доктор Бульба море;1917;279
Санджиев;Николай;Станиславовна;Сердце из Гарпа не;1900;407
Баринов;Марк;Равкатовна;Мор, души Маргарита кукушки Азкабана;1968;32
Васильева;Наталия;Павлович;Война Баскервилей фронте д’Эрбервиллей 44-го);1906;331
Клянчин;Валерия;Вячеславович;Пётр Каренина время и;1960;555
Антонов;Алексей;Андреевич;Рудин дом Стране кукушки;1939;513
Олефир;Михаил;Намигович;БДВ, Господне Оуэне тихие;1905;723
Хмелев;Артем;Станиславович;Хайди из и;1946;128
Пчелинцев;Лада;Александровна;На из и;1907;343
Молодых;Ясмина;Альбертович;Дюна тысяч Туда Прометей камень;1931;327
Васильева;Юлия;Вадимович;Доктор волшебства 6 узник;1848;175
Коряков;Дмитрий;Григорьевич;Лев, всадник фронте и обитатели;1948;333
Черепанова;Данил;Талантбековна;Игрок ученик мертвые Кубок огня;1950;950
Жмурин;Мария;Васильевич;Благие востоку Юность и;2012;345
Фроловичев;Виктор;Григорьевич;Джейн гвардия любовники;1863;193
Никитин;Кристина;Витальевич;Хоббит, Сергий Юность фабрика перемен;1983;980
Кузнецова;Дария;Дмитриевич;Ким в врача Кубок Ливингстон;1916;739
Дегтярев;Данил;Олегович;Гарри на К Тайная;1984;71
Андреев;Михаил;Станиславовна;Паутина сестры одиночества и;1916;164
Перетятько;Георгий;Михайлович;Бедные сокровищ Твиста Тайная;1885;146
Сабитов;Антон;Георгиевна;Над стульев и кукушки;1932;656
Гребнев;Мирра;Эдуардовна;Тихий западном Людмила оружию! обратно;1906;491
Гридасов;Виктор;Вадимович;Алые Шерлока предубеждение;1911;553
Толмачева;Георгий;Руслановна;Судьба сокровищ Маргарита Прометей;1889;800
Щербаченко;Юрий;Андреевна;451 Онегин Командир;1862;531
Пинаев;Никита;Вячеславович;Сёгун Санникова 6 и;1943;897
Копытин;Данил;Александровна;Мартин начала Холмса Мини;1962;612
Санджиев;Алиса;Разилевна;Борис жнец чердаке Фаренгейту перемен;2014;583
Шехтер;Элина;Андреевич;Сердце на Твиста и огня;1903;544
Савельичев;Сергей;Георгиевна;Цвет ветром наказание;1870;185
Харисова;Елена;Владимирович;Бег морей: Оуэне оружию! обитатели;2001;372
Зайнутдинова;Григорий;Разилевна;Винни ШКИД подполья под;1881;696
Батурин;Федор;Алексеевич;Имя Гэтсби терновнике без обратно;2021;150
Померанцев;Юлия;Сергеевич;Чужестранка принц гнездом без;1897;709
Джинчарадзе;Юлия;Сергеевич;Девчонки Незаметный (В клуба считая;1965;350
Молодых;Максим;Ришатович;Король Поттер гнездом Том;1855;827
Щербаченко;Мария;Сергеевна;Мир на Оуэне Кубок Азкабана;1849;343
Балинова;Артем;Александровна;Автостопом гвардия К рая;1883;83
Собко;Дария;Андреевна;Джуд на 6 оружию!;1895;124
Милаева;Виктор;Александрович;Унесённые Эйр мир под;1921;407
Марков;Симон;Ильдарович;Бесы гуляют Грея клуба комната собаки;1915;926
Бекетова;Арина;Романович;Франкенштейн, пленник чердаке;1933;121
Савельичев;Алексей;Дмитриевич;Ужастики Каренина 6 не;2017;23
Швырев;София;Анатольевна;Хождение об фронте людях Ливингстон;1972;206
Жмурин;Виктор;Олегович;Гарри Оливера Людмила;2013;671
Бекетова;Ирина;Олеговна;Крестный о и без шкаф;1923;591
Люкшин;Галина;Станиславовна;Король и Пиквикского оружию!;1858;305
Антонов;Регина;Викторовна;Собор оружию! Джонс платяной;1922;22
Глазачев;Елена;Максимович;Приключения гнева лье платяной водой;1993;488
Нуртдинов;Иван;Алексеевна;Алхимик западном и Мезонинов комната;1984;895
Сабитов;Арина;Талантбековна;Иван востоку Командир его;1893;235
Марков;Регина;Дмитриевич;Сердце Поттер и Фаренгейту;1856;469
Романовский;Магомед;Даниловна;Обладать дивный галактике;1857;901
Новиков;Элеонора;Константинович;Гарри колец фронте Мини;1874;887
Усманов;Александр;Батырович;Возвращение и любовники тихие;1933;441
Козырева;Евгений;Дмитриевич;Гарри тысяч мир Прометей комната собаки;1865;312
Васильев;Алексей;Вагабович;А стража предубеждение Прометей Азкабана;1866;675
Теслюк;Анна;Исламовна;О Васильевич и ржи добрый;1998;29
Васильев;Эльфат;Тамазович;Граф Крузо времени чудес огня;1844;200
Сайфуллина;Екатерина;Владимирович;Пётр мух и;1991;526
Никитин;Дарья;Алексеевна;Записки и ивах;1918;477
Шехтер;Алиса;Юрьевич;Дети сестры оскорблённые грядущего;1846;601
Сайфуллина;Ирина;Константинович;Любовь песнь ума без обратно;1931;710
Зайнутдинова;Михаил;Вячеславович;Спокойной колец Грея колокол штурман великан;1859;427
Лилина;Анастасия;Сергеевич;Отверженные гнева Гарпа без;2019;984
Галиева;Бегимай;Григорьевич;Морфий теленок гнездом рая;2012;272
Масликов;Владимир;Альбертович;По Дик и персик;1984;227
Милаева;Виталий;Александрович;Трудно Клык терновнике чудес;1884;773
Феодосьев;Егор;Владимирович;Джейн Бриджит и Том;1924;102
Безель;Дмитрий;Михайлович;Пётр колец гигантский тихие добрый;1860;480
Милаева;Егор;Александровна;Джеймс рассказы Грея Прометей;1917;367
Савченко;Никита;Денисович;Драма гнездо и д’Эрбервиллей;1897;844
Темурбекова;Юлия;Максимовна;Невыносимая Поттер бытия;2018;523
Николаев;Виталий;Эдуардовна;Пролетая тьмы и без обитатели;1913;312
Джинчарадзе;Дмитрий;Николаевич;Приключения и Лис Мезонинов 44-го);1987;853
Померанцев;Дмитрий;Григорьевич;Мор, жнец фронте;1913;241
Баринова;Антон;Разилевна;Пятый по Финна городах;1994;37
Вирютин;Ирина;Александровна;Анна Иден (В колокол;1849;393
Игнатьев;Ангелина;Александрович;Доводы Эйр море Джонатан;1949;171
Волох;Айдана;Ильсеярович;Гарри Санникова фронте грядущего;1949;675
Марков;Георгий;Тимуровна;Вечера сокровищ границей городах обратно;1983;722
Баринов;Лука;Васильевич;Дядя пересмешника и оружию!;1848;992
Галкин;Айдана;Михайлович;Записки дочка Лис кукушки камень;1865;85
Антонов;Вадим;Руслановна;1984 Парижской мистер под;1871;979
Власенко;Елена;Карамалиева;Бедные мышах мистер;1867;300
Темурбекова;Анастасия;Витальевич;Санта-Хрякус и Мёртвого Кубок считая;1872;193
Глазачев;Глеб;Максимовна;К пересмешника и ржи;1940;260
Борисова;Яна;Дмитриевич;Белый колдунья Финна и огня;1975;686
Селиванова;Анна;Олеговна;Тихий в новый;1907;658
Масликов;Дарья;Андреевич;Пятый лет и его;2010;964
Панов;Станислав;Ильдарович;Джуд и Твиста близ;1861;934
Тихонов;Юрий;Дмитриевич;Граф морей: море Прометей;1937;133
Джинчарадзе;Гордей;Максимовна;Записки всадник море рая добрый;2000;659
Куулар;Владимир;Владимирович;Мемуары былого по без;1857;797
Гафурова;Виктор;Станиславович;Чайка принц Большой кукушки;1896;61
Спирин;Алексей;Георгиевна;Пролетая ком Большой клуба перемен;1941;520
Бездольный;Георгий;Федорович;Отец Белкина Лис;1897;24
Солдатов;Ясмина;Борисович;Судьба востоку Брайдсхед платяной добрый;1894;707
Гаянов;Юрий;Андреевич;Невыносимая пленник обочине кукушки камень;1879;274
Никитина;Алексей;Николаевич;Старик в Юность кукушки добрый собаки;1995;696
Минубаев;Василий;Гаряевич;Война Изумрудного;1870;922
Никитин;Константин;Валерьевна;На и мистер тихие 44-го);1928;702
Феодосьев;Георгий;Константинович;Граф из Лис кукушки обитатели;1981;119
Васильев;Даниил;Бакытбековна;Ветер Санникова Богоматери;1928;563
Солдатов;Павел;Алексеевич;Судьба песнь Лис;1872;858
Пинаев;Александр;Михайлович;Дворянское Фаул времени ржи перемен;1863;36
Гаянов;Николай;Бакытбековна;Волхв нашего Брайдсхед городах обитатели;1923;580
Блюм;Анастасия;Павлович;Борис сокровищ Маргарита его;2016;585
Черепанова;Анна;Андреевна;Джейн и мир под;1904;967
Мансуров;Элеонора;Андреевна;Пляж на и холеры;1864;52
Рубайко;Сергей;Александрович;Стража! Поттер любовники ржи;1873;562
Гафурова;Дмитрий;Георгиевна;Чужестранка лет лье Фаренгейту;1980;293
Сильвентойнен;Кирилл;Васильевич;На мушкетера здесь рая обитатели;1980;290
Милаева;Игорь;Алексеевич;Маленький во Маргарита кукушки;1960;17
Балинова;Дмитрий;Петрович;Хайди волшебства Большой мир;1878;563
Садыхов;Полина;Ильдарович;Великий гвардия Форсайтах без огня;1920;104
Борисова;Иван;Евгеньевна;Роковая принц Твиста без обитатели;1893;883
Шехтер;Виталий;Вячеславовна;Пиковая Эйр гнездом грядущего;1987;197
Черноиванова;Марк;Николаевич;Гарри Баскервилей время близ добрый;1975;593
Чинилов;Артемий;Андреевич;Мелкие дом богом близ;1890;487
Блюм;Александр;Алексеевна;Чужестранка над здесь;1925;396
Чертова;Дмитрий;Михайлович;Пётр Парижской оскорблённые;1969;267
Гребнев;Виктория;Артемович;Столпы и мукам грядущего комната;1992;879
Хангильдин;Гулабру;Александрович;Скотный стульев гигантский близ;1847;507
Садыхов;София;Вячеславовна;Гарри № фронте ржи Диканьки;2004;634
Шмелев;Дарья;Андреевич;Капитанская Софии и без обратно;1927;843
Санджиев;Анна;Сергеевич;Пение записки во ржи;1982;72
Кузнецова;Даниил;Денисович;Противостояние боги море Мини;1858;828
Блюм;Даня;Андреевич;Село и мир Мини;1986;213
Васильев;Данил;Вячеславовна;Три и дети;1957;522
Земчик;Карам;Игоревич;Мастер люди новый и добрый;1917;104
Исакова;Даниил;Алексеевна;Девчонки отец (В кукушки;1894;361
Александров;Виталий;Вадимович;Роковая птиц время кукушки обратно;1873;381
Шагимарданова;Анастасия;Вагабович;Кавказский в Форсайтах Фаренгейту Диканьки;1863;83
Иванова;Михаил;Александровна;Цветы Степанчиково море без;1939;591
Москаленко;Софья;Георгиевна;Искупление градус дети персик;1954;317
Масликов;Анна;Геннадьевна;Подросток в и Том;1869;705
Алексанов;Гулабру;Максимовна;Гордость Карамазовы и оружию! 44-го);1903;917
Николаев;Станислав;Валерьевич;Белый Каренина время оружию! 44-го);1945;512
Хахарова;Вадим;Алексеевич;Живые и галактике Том Азкабана;1975;554
Москаленко;Иван;Ильсеярович;Франкенштейн, и хуторе и;1856;111
Перетятько;Андрей;Валерьевич;Дюна Иден рода Прометей обратно;1967;147
Санджиев;Николай;Бакытбековна;Республика ком Сойера;1897;529
Николаев;Иван;Рамильевич;Американский на чердаке Тайная;2018;472
Нуртдинов;Павел;Андреевич;Руслан Шерлока Джонс августе перемен;1985;137
Салдусов;Лука;Денисович;Пролетая Поттер Оуэне без;1954;105
Егорова;Анна;Альбертович;Борис двор оскорблённые платяной обратно;1895;642
Зырянов;Камилла;Олегович;Левша тьмы мертвые и;1985;532
Бурцев;Федор;Александрович;Ведьмы и границей;1937;581
Власенко;Эльдар;Николаевич;Братья Крузо Сойера персик обратно;1949;792
Пена;Валерия;Максимовна;Бесприданница востоку одиночества Джонатан;1949;780
Черноиванова;Валерия;Олегович;Чайка времени обочине Том;1997;269
Грибкова;Арина;Валерьевич;Гроздья миров Зеленых городах штурман;1955;295
Садыхов;Михаил;Ильдарович;Обитатели мушкетера и и;1875;599
Никитин;Виктория;Владимировна;Джейн стульев Туда не;1966;236
Баринова;Лука;Александрович;Осиная сестрички Лис и;1893;166
Олефир;Николай;Хусниддиновна;Мёртвые истины богом Кубок огня;1975;25
Зубенок;Николай;Борисович;Пролетая дивный по городах Ливингстон;2019;652
Москаленко;Кирилл;Алексеевич;Борис сад и узник;1996;489
Алишерова;Магомед;Ильсеярович;Пикник двор мир и;1877;183
Кирьянов;Кирилл;Андреевна;Уловка-22 Кэстербриджа Холмса персик;1847;285
Черноиванова;Дмитрий;Айдаровна;Мотылёк Клык Маргарита кукушки;1950;62
Бекетова;Владислав;Валерьевич;Парфюмер фабрика Пиквикского чудес;1872;155
Джинчарадзе;Владимир;Николаевич;Отверженные гейши мистер;1891;936
Савченко;Владимир;Николаевич;Джейн Живаго Командир Кубок;1858;527
Молодых;Булат;Владимирович;Великий Поттер подполья городах;1960;810
Солдатов;Анна;Михайловна;Сердце игле 6;1858;227
Васильев;Роман;Анатольевна;Лорна над лодке, колокол;1845;973
Дьячкова;Малик;Иванович;Спокойной обелиск и чудес;1848;905
Спирин;Василий;Вячеславович;Мир по врача философский;1990;433
Сильвентойнен;Полина;Владимирович;О сокровищ рода городах;2015;96
Савченко;Галина;Сергеевич;Судьба юного допоздна колокол комната;1956;42
Нуртдинов;София;Бакытбековна;Ким колдунья лодке, без;2005;180
Шишкин;Эдуард;Витальевич;Записки Монте-Кристо фронте людях;1863;698
Чернов;Дарья;Олегович;Горе Кэстербриджа мистер без;1945;452
Колесников;Александр;Васильевна;Анна Поттер Стране Том;1895;527
Хайрутдинова;Дария;Александрович;Анна жнец Большой Прометей Азкабана;2011;855
Игнатьев;Марк;Алексеевич;Хождение Первый К ржи;1953;541
