Егорова;Марк;Васильевич;Сыновья Крузо Финна фабрика;1870;412
Гребенкин;Иван;Гумаровна;Евгений надежды Твиста;1931;733
Власенко;Карам;Олеговна;Крестный триффидов К людях;1901;428
Балинова;Марк;Сергеевич;Лев, Крузо Сойера платяной;1863;718
Масликов;Алексей;Анатольевна;На о гнездом Мини;1866;884
Гусейнли;Юлия;Гумаровна;Сёгун ученик чердаке чудес;2018;619
Копытин;Лука;Ильсеярович;Большие Санникова Грея;1869;586
Пена;Дмитрий;Викторовна;Пятый Санникова фронте;1887;172
Васильева;Андрей;Витальевич;Властелин из Зеленых ржи 44-го);1879;197
Лилина;Мария;Витальевич;Горменгаст и одиночества дома штурман собаки;1862;70
Гафурова;Анастасия;Юрьевич;Крестный ком Джонс фабрика Диканьки;1903;805
Куликова;Артём;Петрович;Тихий Белкина Брайдсхед;1898;807
Гаянов;Кирилл;Равкатовна;Двадцать сестрички лодке, мир;1992;834
Сайфуллина;Яков;Георгиевич;Мартин Эйр терновнике колокол Диканьки;1865;484
Бурцев;Даня;Гаряевич;На и во Фаренгейту;1919;765
Борисова;Андрей;Вадимович;Портрет зори Лис и;1850;744
Хайрутдинова;Михаил;Игоревич;Ревизор зори лье философский;1869;822
Чертова;Малик;Эдуардовна;Автостопом рассудка Брайдсхед Джонатан;1909;949
Базоева;Максим;Александрович;Ярмарка сердце Холмса августе;1948;898
Девяткин;Данил;Дмитриевна;Лолита Монте-Кристо и холеры;1941;931
Сабитов;Юлия;Сергеевич;Лев, из терновнике Том камень;1852;98
Ткаченко;Александр;Олегович;Три гейши времени платяной;1864;872
Зырянов;Андрей;Марсовна;Божество Ваня Холмса кукушки;1914;637
Темурбекова;Елена;Андреевич;Холодный Крузо Туда персик;1914;871
Джинчарадзе;Владимир;Федорович;Мемуары песнь Современный Фаренгейту;1996;844
Кузнецова;Александр;Ильдарович;Мартин принц дети чудес шкаф;1974;721
Гаянов;Мирра;Николаевич;Граф и лодке, кукушки;1876;170
Торжков;Дарья;Владимирович;Доктор ночи, время мир;1997;908
Бескровная;Александр;Васильевич;Момент Шакала Мёртвого грядущего;1916;967
Дегтярев;Константин;Александровна;Автостопом стража (В клуба;1855;43
Алексанов;Карам;Евгеньевна;Отверженные в и;2015;511
Клянчин;Арина;Рамильевич;Американский мистер Современный;1996;644
Борисова;Григорий;Витальевич;Тихий Онегин мир;1896;919
Милаева;Анна;Ильдарович;Приключения ночи, дети людях;1940;196
Словеснов;Артём;Алексеевич;Противостояние пропастью Мёртвого грядущего Ливингстон;1895;775
Чертова;Виктор;Алексеевич;Зеленая во Оуэне;1862;856
Торжков;Владимир;Равкатовна;Драма Бульба Юность Мезонинов перемен;1855;178
Волох;Гордей;Александрович;Портрет или и Джонатан Ливингстон;1973;904
Нуртдинов;Александр;Разилевна;Приключения полуночи Форсайтах;1969;110
Минубаев;Георгий;Айдаровна;Иван юного Форсайтах Том;1864;973
Шишкин;Галина;Павлович;Записки музыка фронте;1988;255
Зайнутдинова;Владислав;Ильдарович;Чайка востоку границей без;2014;863
Старшинов;Элеонора;Станиславовна;Крестный стража Маргарита фабрика;2009;989
Собко;Магомед;Равкатовна;Ужастики психопат 6 Джонатан добрый;1841;948
Панов;Георгий;Александровна;Старик или;1991;629
Егорова;Дарья;Владимирович;Уловка-22 мистер ивах чудес;1889;373
Исакова;Юлия;Владимировна;Гарри дивный границей оружию! перемен;1979;544
Иванова;Долума;Александрович;Столпы Копперфильд Туда тихие;1860;163
Баринов;Эльдар;Николаевич;Искупление птиц охоте колокол;1956;89
Хахарова;Илья;Федорович;Сто реки море фабрика обитатели;1996;890
Зырянов;Малик;Денисович;Хозяин Каренина шоколадная и;1952;59
Амирханов;Максим;Александровна;Сто в Твиста городах;1922;541
Савченко;Евгений;Сергеевна;Двадцать записки имени августе водой;1864;934
Лилина;Арина;Алексеевич;Спокойной отец мертвые людях штурман;1945;309
Девяткин;Валерия;Олеговна;Доктор Бульба море;1961;636
Санджиев;Николай;Станиславовна;Сердце из Гарпа не;1859;948
Баринов;Марк;Равкатовна;Мор, души Маргарита кукушки Азкабана;1886;556
Васильева;Наталия;Павлович;Война Баскервилей фронте д’Эрбервиллей 44-го);1937;937
Клянчин;Валерия;Вячеславович;Пётр Каренина время и;1874;142
Антонов;Алексей;Андреевич;Рудин дом Стране кукушки;1988;261
Олефир;Михаил;Намигович;БДВ, Господне Оуэне тихие;1972;465
Хмелев;Артем;Станиславович;Хайди из и;1878;785
Пчелинцев;Лада;Александровна;На из и;1901;507
Молодых;Ясмина;Альбертович;Дюна тысяч Туда Прометей камень;1926;353
Васильева;Юлия;Вадимович;Доктор волшебства 6 узник;1878;681
Коряков;Дмитрий;Григорьевич;Лев, всадник фронте и обитатели;1992;226
Черепанова;Данил;Талантбековна;Игрок ученик мертвые Кубок огня;1867;237
Жмурин;Мария;Васильевич;Благие востоку Юность и;1892;216
Фроловичев;Виктор;Григорьевич;Джейн гвардия любовники;1972;767
Никитин;Кристина;Витальевич;Хоббит, Сергий Юность фабрика перемен;1937;680
Кузнецова;Дария;Дмитриевич;Ким в врача Кубок Ливингстон;1908;655
Дегтярев;Данил;Олегович;Гарри на К Тайная;1898;589
Андреев;Михаил;Станиславовна;Паутина сестры одиночества и;1994;290
Перетятько;Георгий;Михайлович;Бедные сокровищ Твиста Тайная;2002;660
Сабитов;Антон;Георгиевна;Над стульев и кукушки;1880;640
Гребнев;Мирра;Эдуардовна;Тихий западном Людмила оружию! обратно;1927;720
Гридасов;Виктор;Вадимович;Алые Шерлока предубеждение;1893;128
Толмачева;Георгий;Руслановна;Судьба сокровищ Маргарита Прометей;1853;643
Щербаченко;Юрий;Андреевна;451 Онегин Командир;1923;440
Пинаев;Никита;Вячеславович;Сёгун Санникова 6 и;1863;55
Копытин;Данил;Александровна;Мартин начала Холмса Мини;1901;812
Санджиев;Алиса;Разилевна;Борис жнец чердаке Фаренгейту перемен;1888;374
Шехтер;Элина;Андреевич;Сердце на Твиста и огня;1968;212
Савельичев;Сергей;Георгиевна;Цвет ветром наказание;1938;754
Харисова;Елена;Владимирович;Бег морей: Оуэне оружию! обитатели;1847;266
Зайнутдинова;Григорий;Разилевна;Винни ШКИД подполья под;1907;947
Батурин;Федор;Алексеевич;Имя Гэтсби терновнике без обратно;1976;403
Померанцев;Юлия;Сергеевич;Чужестранка принц гнездом без;2013;986
Джинчарадзе;Юлия;Сергеевич;Девчонки Незаметный (В клуба считая;2017;545
Молодых;Максим;Ришатович;Король Поттер гнездом Том;1876;818
Щербаченко;Мария;Сергеевна;Мир на Оуэне Кубок Азкабана;1965;122
Балинова;Артем;Александровна;Автостопом гвардия К рая;1984;522
Собко;Дария;Андреевна;Джуд на 6 оружию!;1866;553
Милаева;Виктор;Александрович;Унесённые Эйр мир под;1860;598
Марков;Симон;Ильдарович;Бесы гуляют Грея клуба комната собаки;1900;34
Бекетова;Арина;Романович;Франкенштейн, пленник чердаке;1898;215
Савельичев;Алексей;Дмитриевич;Ужастики Каренина 6 не;1915;901
Швырев;София;Анатольевна;Хождение об фронте людях Ливингстон;1870;271
Жмурин;Виктор;Олегович;Гарри Оливера Людмила;1948;72
Бекетова;Ирина;Олеговна;Крестный о и без шкаф;1978;697
Люкшин;Галина;Станиславовна;Король и Пиквикского оружию!;1938;54
Антонов;Регина;Викторовна;Собор оружию! Джонс платяной;1848;96
Глазачев;Елена;Максимович;Приключения гнева лье платяной водой;1862;25
Нуртдинов;Иван;Алексеевна;Алхимик западном и Мезонинов комната;1892;915
Сабитов;Арина;Талантбековна;Иван востоку Командир его;1962;382
Марков;Регина;Дмитриевич;Сердце Поттер и Фаренгейту;1941;956
Романовский;Магомед;Даниловна;Обладать дивный галактике;1890;403
Новиков;Элеонора;Константинович;Гарри колец фронте Мини;2001;503
Усманов;Александр;Батырович;Возвращение и любовники тихие;1879;733
Козырева;Евгений;Дмитриевич;Гарри тысяч мир Прометей комната собаки;1854;477
Васильев;Алексей;Вагабович;А стража предубеждение Прометей Азкабана;1890;500
Теслюк;Анна;Исламовна;О Васильевич и ржи добрый;1914;489
Васильев;Эльфат;Тамазович;Граф Крузо времени чудес огня;1943;514
Сайфуллина;Екатерина;Владимирович;Пётр мух и;1863;763
Никитин;Дарья;Алексеевна;Записки и ивах;1930;280
Шехтер;Алиса;Юрьевич;Дети сестры оскорблённые грядущего;1957;360
Сайфуллина;Ирина;Константинович;Любовь песнь ума без обратно;1989;202
Зайнутдинова;Михаил;Вячеславович;Спокойной колец Грея колокол штурман великан;1902;512
Лилина;Анастасия;Сергеевич;Отверженные гнева Гарпа без;1841;369
Галиева;Бегимай;Григорьевич;Морфий теленок гнездом рая;1899;275
Масликов;Владимир;Альбертович;По Дик и персик;1899;32
Милаева;Виталий;Александрович;Трудно Клык терновнике чудес;1996;376
Феодосьев;Егор;Владимирович;Джейн Бриджит и Том;1917;169
Безель;Дмитрий;Михайлович;Пётр колец гигантский тихие добрый;1948;870
Милаева;Егор;Александровна;Джеймс рассказы Грея Прометей;2017;467
Савченко;Никита;Денисович;Драма гнездо и д’Эрбервиллей;2019;397
Темурбекова;Юлия;Максимовна;Невыносимая Поттер бытия;1950;817
Николаев;Виталий;Эдуардовна;Пролетая тьмы и без обитатели;1854;387
Джинчарадзе;Дмитрий;Николаевич;Приключения и Лис Мезонинов 44-го);1980;134
Померанцев;Дмитрий;Григорьевич;Мор, жнец фронте;1991;656
Баринова;Антон;Разилевна;Пятый по Финна городах;1852;671
Вирютин;Ирина;Александровна;Анна Иден (В колокол;1916;57
Игнатьев;Ангелина;Александрович;Доводы Эйр море Джонатан;1927;568
Волох;Айдана;Ильсеярович;Гарри Санникова фронте грядущего;1856;654
Марков;Георгий;Тимуровна;Вечера сокровищ границей городах обратно;1897;343
Баринов;Лука;Васильевич;Дядя пересмешника и оружию!;1963;109
Галкин;Айдана;Михайлович;Записки дочка Лис кукушки камень;1881;383
Антонов;Вадим;Руслановна;1984 Парижской мистер под;1951;655
Власенко;Елена;Карамалиева;Бедные мышах мистер;1964;615
Темурбекова;Анастасия;Витальевич;Санта-Хрякус и Мёртвого Кубок считая;1979;124
Глазачев;Глеб;Максимовна;К пересмешника и ржи;1930;520
Борисова;Яна;Дмитриевич;Белый колдунья Финна и огня;1976;960
Селиванова;Анна;Олеговна;Тихий в новый;1945;983
Масликов;Дарья;Андреевич;Пятый лет и его;1973;215
Панов;Станислав;Ильдарович;Джуд и Твиста близ;1931;891
Тихонов;Юрий;Дмитриевич;Граф морей: море Прометей;1882;95
Джинчарадзе;Гордей;Максимовна;Записки всадник море рая добрый;1949;243
Куулар;Владимир;Владимирович;Мемуары былого по без;1881;404
Гафурова;Виктор;Станиславович;Чайка принц Большой кукушки;1910;233
Спирин;Алексей;Георгиевна;Пролетая ком Большой клуба перемен;1901;305
Бездольный;Георгий;Федорович;Отец Белкина Лис;1881;128
Солдатов;Ясмина;Борисович;Судьба востоку Брайдсхед платяной добрый;2008;760
Гаянов;Юрий;Андреевич;Невыносимая пленник обочине кукушки камень;1979;778
Никитина;Алексей;Николаевич;Старик в Юность кукушки добрый собаки;1901;964
Минубаев;Василий;Гаряевич;Война Изумрудного;1989;739
Никитин;Константин;Валерьевна;На и мистер тихие 44-го);1890;854
Феодосьев;Георгий;Константинович;Граф из Лис кукушки обитатели;1906;247
Васильев;Даниил;Бакытбековна;Ветер Санникова Богоматери;1850;186
Солдатов;Павел;Алексеевич;Судьба песнь Лис;1979;316
Пинаев;Александр;Михайлович;Дворянское Фаул времени ржи перемен;1877;252
Гаянов;Николай;Бакытбековна;Волхв нашего Брайдсхед городах обитатели;1858;678
Блюм;Анастасия;Павлович;Борис сокровищ Маргарита его;1850;791
Черепанова;Анна;Андреевна;Джейн и мир под;1844;775
Мансуров;Элеонора;Андреевна;Пляж на и холеры;1903;835
Рубайко;Сергей;Александрович;Стража! Поттер любовники ржи;2019;308
Гафурова;Дмитрий;Георгиевна;Чужестранка лет лье Фаренгейту;1863;697
Сильвентойнен;Кирилл;Васильевич;На мушкетера здесь рая обитатели;1997;318
Милаева;Игорь;Алексеевич;Маленький во Маргарита кукушки;2007;381
Балинова;Дмитрий;Петрович;Хайди волшебства Большой мир;1944;999
Садыхов;Полина;Ильдарович;Великий гвардия Форсайтах без огня;1962;896
Борисова;Иван;Евгеньевна;Роковая принц Твиста без обитатели;2007;167
Шехтер;Виталий;Вячеславовна;Пиковая Эйр гнездом грядущего;1990;486
Черноиванова;Марк;Николаевич;Гарри Баскервилей время близ добрый;1842;157
Чинилов;Артемий;Андреевич;Мелкие дом богом близ;2019;237
Блюм;Александр;Алексеевна;Чужестранка над здесь;1936;289
Чертова;Дмитрий;Михайлович;Пётр Парижской оскорблённые;1943;614
Гребнев;Виктория;Артемович;Столпы и мукам грядущего комната;2005;936
Хангильдин;Гулабру;Александрович;Скотный стульев гигантский близ;1941;987
Садыхов;София;Вячеславовна;Гарри № фронте ржи Диканьки;1884;252
Шмелев;Дарья;Андреевич;Капитанская Софии и без обратно;1902;236
Санджиев;Анна;Сергеевич;Пение записки во ржи;1967;97
Кузнецова;Даниил;Денисович;Противостояние боги море Мини;1957;217
Блюм;Даня;Андреевич;Село и мир Мини;1922;538
Васильев;Данил;Вячеславовна;Три и дети;1920;489
Земчик;Карам;Игоревич;Мастер люди новый и добрый;1998;801
Исакова;Даниил;Алексеевна;Девчонки отец (В кукушки;1904;626
Александров;Виталий;Вадимович;Роковая птиц время кукушки обратно;1999;120
Шагимарданова;Анастасия;Вагабович;Кавказский в Форсайтах Фаренгейту Диканьки;1922;923
Иванова;Михаил;Александровна;Цветы Степанчиково море без;1925;112
Москаленко;Софья;Георгиевна;Искупление градус дети персик;1888;895
Масликов;Анна;Геннадьевна;Подросток в и Том;1884;828
Алексанов;Гулабру;Максимовна;Гордость Карамазовы и оружию! 44-го);1896;962
Николаев;Станислав;Валерьевич;Белый Каренина время оружию! 44-го);1852;326
Хахарова;Вадим;Алексеевич;Живые и галактике Том Азкабана;1936;187
Москаленко;Иван;Ильсеярович;Франкенштейн, и хуторе и;1934;207
Перетятько;Андрей;Валерьевич;Дюна Иден рода Прометей обратно;1864;783
Санджиев;Николай;Бакытбековна;Республика ком Сойера;1926;685
Николаев;Иван;Рамильевич;Американский на чердаке Тайная;2008;806
Нуртдинов;Павел;Андреевич;Руслан Шерлока Джонс августе перемен;1951;900
Салдусов;Лука;Денисович;Пролетая Поттер Оуэне без;1935;863
Егорова;Анна;Альбертович;Борис двор оскорблённые платяной обратно;1869;841
Зырянов;Камилла;Олегович;Левша тьмы мертвые и;1945;488
Бурцев;Федор;Александрович;Ведьмы и границей;1894;349
Власенко;Эльдар;Николаевич;Братья Крузо Сойера персик обратно;1962;250
Пена;Валерия;Максимовна;Бесприданница востоку одиночества Джонатан;1915;94
Черноиванова;Валерия;Олегович;Чайка времени обочине Том;1924;719
Грибкова;Арина;Валерьевич;Гроздья миров Зеленых городах штурман;1857;343
Садыхов;Михаил;Ильдарович;Обитатели мушкетера и и;1851;333
Никитин;Виктория;Владимировна;Джейн стульев Туда не;1997;509
Баринова;Лука;Александрович;Осиная сестрички Лис и;2002;802
Олефир;Николай;Хусниддиновна;Мёртвые истины богом Кубок огня;1957;441
Зубенок;Николай;Борисович;Пролетая дивный по городах Ливингстон;2017;434
Москаленко;Кирилл;Алексеевич;Борис сад и узник;1856;561
Алишерова;Магомед;Ильсеярович;Пикник двор мир и;1910;815
Кирьянов;Кирилл;Андреевна;Уловка-22 Кэстербриджа Холмса персик;1852;321
Черноиванова;Дмитрий;Айдаровна;Мотылёк Клык Маргарита кукушки;1991;616
Бекетова;Владислав;Валерьевич;Парфюмер фабрика Пиквикского чудес;1849;351
Джинчарадзе;Владимир;Николаевич;Отверженные гейши мистер;1917;309
Савченко;Владимир;Николаевич;Джейн Живаго Командир Кубок;1942;753
Молодых;Булат;Владимирович;Великий Поттер подполья городах;1958;864
Солдатов;Анна;Михайловна;Сердце игле 6;1864;918
Васильев;Роман;Анатольевна;Лорна над лодке, колокол;2012;956
Дьячкова;Малик;Иванович;Спокойной обелиск и чудес;1984;400
Спирин;Василий;Вячеславович;Мир по врача философский;1882;580
Сильвентойнен;Полина;Владимирович;О сокровищ рода городах;1931;110
Савченко;Галина;Сергеевич;Судьба юного допоздна колокол комната;1846;378
Нуртдинов;София;Бакытбековна;Ким колдунья лодке, без;1892;775
Шишкин;Эдуард;Витальевич;Записки Монте-Кристо фронте людях;1878;342
Чернов;Дарья;Олегович;Горе Кэстербриджа мистер без;1931;474
Колесников;Александр;Васильевна;Анна Поттер Стране Том;1860;510
Хайрутдинова;Дария;Александрович;Анна жнец Большой Прометей Азкабана;1985;79
Игнатьев;Марк;Алексеевич;Хождение Первый К ржи;1906;664
