Баринова;Роберт;Ильдарович;Воскресение над и городах Ливингстон;1889;882
Карухов;Иван;Александрович;Кавказский и города Кубок;1973;166
Андреев;Мирра;Даниловна;Подросток дивный Оуэне его обитатели;1841;185
Бекетова;Кристина;Михайлович;Чужестранка на шоколадная;1853;703
Новиков;Алексей;Андреевич;Три человека хуторе людях водой;1894;761
Шкляев;Софья;Александрович;Дети ночи, Твиста Фаренгейту;1879;583
Темурбекова;Екатерина;Иванович;Мотылёк холмов (В оружию!;1954;815
Олефир;Симон;Вячеславович;Невыносимая из от и;2011;553
Савченко;Мирра;Романович;Алиса по Большой грядущего обратно;1847;181
Гребенкин;Долума;Юрьевич;Детство. Бульба Джонс его обитатели;1877;485
Карухов;Артём;Александрович;Анна истины новый дома;1890;545
Зырянов;Михаил;Тимуровна;Большие и Зеленых его;1953;866
Быковский;Юрий;Витальевич;Чайка былого мир близ;1975;414
Грибкова;Георгий;Григорьевич;Сыновья Тома море;1917;105
Мансуров;Дария;Игоревич;О паруса Людмила Фаренгейту;1912;169
Пинаев;Полина;Ильдарович;В Копперфильд одиночества Том шкаф;1885;223
Шишкин;Павел;Александровна;День тьмы границей Джонатан огня;1909;689
Галиева;Кристина;Вячеславович;Джейн юного Холмса;2010;223
Галкин;Эльфат;Николаевич;Оно над подполья философский водой;1994;384
Чертова;Федор;Валерьевич;Левша и мукам его;1870;436
Игнатьев;Никита;Геннадьевна;Великий Стража! Богоматери;2014;678
Ефимов;Валерия;Максимович;Вечера Иден хуторе;1889;813
Романовский;Александр;Вячеславовна;Маленький элефант обочине под;1844;637
Теслюк;Никита;Марсовна;451 по Грея августе перемен великан;1932;255
Савченко;Анастасия;Эдуардовна;Пролетая элефант и мир;2003;447
Гребнев;Николай;Александровна;Сто нашего богом мир;1846;887
Иванова;Даниил;Максимович;Парфюмер дочка и фабрика;1893;993
Безель;Никита;Рафиковна;Два розы Большой кукушки;1987;551
Жмурин;Наталия;Владимирович;Паутина Годунов и колокол;1864;285
Черноиванова;Владислав;Максимовна;Мор, в границей персик Ливингстон;1990;886
Феодосьев;Валерия;Георгиевна;Собака гуляют море тихие;1874;793
Савельичев;София;Равкатовна;Пятый во Юность ржи шкаф;1879;342
Пчелинцев;Кристина;Тимуровна;Преступление Белкина Лис без;1926;338
Гусейнли;Лада;Евгеньевна;Приключения гнева допоздна Кубок перемен;2014;318
Словеснов;Ирина;Олегович;Лето Дориана Сойера мир;1944;329
Хайрутдинова;Дария;Дмитриевич;Великий Стража! звонит;1865;890
Кудрявцева;Лада;Николаевич;Дракула дивный гигантский персик;1856;725
Панов;Мария;Андреевич;Черный Поттер Маргарита;1882;648
Сабитов;Никита;Валерьевна;Пикник № одиночества рая;1846;254
Андреев;Владислав;Олеговна;Горе Первый гнездом;1897;149
Сильвентойнен;Анастасия;Ильдарович;К или Лис Фаренгейту;1941;585
Баринова;Николай;Ильсеярович;Записки Клык города Прометей Диканьки;1889;440
Баринов;Егор;Сергеевич;Гарри сестры одиночества узник;1953;350
Клянчин;Александр;Владимирович;Мэр на Маргарита колокол комната;1963;763
Пена;Элина;Александрович;Поющие Степанчиково 6 мир шкаф;1942;354
Николаев;Максим;Вячеславовна;Цветы дочка чердаке тихие;1973;610
Романовский;Юрий;Николаевич;Горменгаст былого и;1937;26
Мансуров;Лука;Александрович;Земля элефант границей тихие комната;1881;995
Игнатьев;Ясмина;Алексеевич;А в одиночества оружию! добрый;1977;299
Сабитов;Никита;Андреевич;Подросток из подполья кукушки шкаф;1903;939
Усманов;Владислав;Григорьевич;Граф Земли К Прометей;1963;917
Романовский;Эдуард;Георгиевна;Гарри из и под;1995;624
Пена;Никита;Викторовна;А колдунья Людмила рая;2011;796
Толмачева;Николай;Ришатович;Холодный сокровищ море Мезонинов штурман;1901;317
Фроловичев;Юлия;Иванович;Отверженные и терновнике тихие считая;1858;628
Шарова;Алиса;Борисович;Столпы розы и дома;1963;956
Алишерова;Лука;Алексеевич;Идиот Баскервилей обочине чудес;1941;471
Галкин;Данил;Алексеевна;1984 востоку Зеленых Фаренгейту перемен;2004;328
Прокопенко;Владислав;Дмитриевич;Роковая градус звонит колокол;2015;781
Словеснов;Наталия;Айдаровна;Волшебник Бриджит (В городах;1860;500
Садыхов;Илья;Альбертович;Король и богом Прометей обитатели;1849;624
Бездольный;Даня;Павлович;Сто № чердаке фабрика;1844;811
Баринова;Мария;Георгиевна;Республика Оливера Туда Мезонинов;2014;574
Харисова;Сергей;Михайлович;Записки колдунья Грея персик обитатели;1954;694
Сабитов;Валерия;Владимирович;Левша боги времени клуба Диканьки;1843;81
Милаева;Артем;Тимуровна;Повести № наказание и;1916;936
Усманов;Максим;Николаевич;Аня Поттер шоколадная философский перемен;1900;900
Коряков;Булат;Артемович;Сёгун и здесь Мезонинов;1929;274
Баринова;Арина;Геннадьевна;Доводы сокровищ Пиквикского платяной водой;1895;901
Лукашева;Антон;Александрович;Обломов розы Стране и;2001;836
Чертова;Елена;Николаевна;Обладать и гнездом холеры Азкабана;1969;775
Ткаченко;Александр;Ильинична;Мелкие Стража! Твиста тихие;1915;122
Бескровная;Вадим;Дмитриевич;Записки юного любовники персик;1961;171
Дьячкова;Ясмина;Станиславович;Повелитель паруса терновнике не штурман;1965;999
Осипов;Иван;Алексеевич;Лев, сердце море;2006;530
Собко;Александр;Гаряевич;О начала Богоматери фабрика;2009;996
Чертова;Павел;Рамильевич;Ярмарка Иден наказание августе;1849;247
Антонов;Павел;Владимирович;Собачье сестрички Пиквикского ржи обратно;2012;287
Лукашева;Роман;Андреевич;Ребекка Гэтсби и его штурман;1845;594
Шехтер;Сергей;Вячеславовна;Казаки и Грея платяной;1889;694
Феодосьев;Алиса;Алексеевич;Двенадцать Монте-Кристо гнездом оружию!;1942;351
Волох;Виктор;Сергеевна;Пятый Клык Людмила и;1999;939
Потемкин;Сергей;Алексеевна;Пляж и Оуэне кукушки перемен;2002;714
Коште;Алиса;Александрович;Приключения тщеславия время Кубок;1875;665
Бескровная;Дмитрий;Николаевич;Чарли или Юность;1928;708
Торжков;Анастасия;Ильдарович;Молитва и и Прометей;1935;80
Савельичев;Максим;Валерьевна;Посмертные Кэстербриджа дети августе;1862;499
Бекетова;Дарья;Николаевич;В Каренина дети городах штурман;2017;900
Батурин;Максим;Вячеславовна;Дядя по фронте колокол добрый;1891;181
Шагимарданова;Дарья;Николаевич;Волшебник Шарлотты Оуэне;1946;362
Блюм;Данил;Александровна;Рассказы Эйр море д’Эрбервиллей добрый;1903;797
Лилина;Виктор;Карамалиева;Ребекка Оливера галактике дома;1982;34
Панов;Ирина;Владимировна;Отверженные двор Финна философский считая;1860;467
Баринов;Елена;Ильдарович;Триумфальная стража здесь Мини;1878;958
Садофьев;Элина;Эдуардовна;Скотный мух и Мини;1911;360
Галиева;Никита;Денисович;Три колдунья море;1967;620
Чинилов;Даниил;Айдаровна;Рассказ былого и;1920;859
Земчик;Дарья;Юрьевич;Граф Монте-Кристо допоздна клуба;1861;203
Толмачева;Александр;Игоревич;Повести Эйр и кукушки Азкабана;1899;710
Бурцев;Виктор;Александровна;Мёртвые и дети Джонатан;1995;870
Панов;Александр;Александровна;Воскресение и море Мини;1970;935
Фроловичев;Данил;Олегович;1984 в К философский Диканьки;1846;878
Кузнецова;Артём;Юрьевич;Мор, Эйр шоколадная Фаренгейту комната;1856;58
Хайрутдинова;Михаил;Станиславович;Доктор юного Богоматери платяной;1885;356
Солдатов;Владислав;Сергеевич;451 Поттер подполья кукушки добрый;1950;252
Жмурин;Никита;Васильевич;1984 колец предубеждение кукушки;1989;416
Блюм;Дмитрий;Юрьевич;Унесённые колдунья двух Джонатан;1974;492
Чертова;Алексей;Рафиковна;Парфюмер на Джонс его;1890;828
Галкин;Федор;Алексеевич;Скотный и Маргарита и;1900;491
Шмелев;Никита;Владимирович;Отцы в врача чудес;1946;258
Солдатов;Ирина;Федорович;Записки дом новый грядущего камень;1840;830
Бурцев;Арина;Валерьевич;Убить гнева по Тайная;1867;760
Пена;Галина;Евгеньевна;Отверженные Эйр шоколадная без;1910;175
Гаянов;Марк;Андреевич;Рождественская и и оружию! водой;1846;431
Агашкина;Михаил;Петрович;Зеленая мух чердаке Том;1865;465
Хахарова;Анастасия;Александровна;Мрачный былого гигантский его;1851;952
Фроловичев;Юрий;Владимировна;Чайка товарища и тихие;1856;838
Торжков;Никита;Алексеевич;Скотный о и августе;1941;479
Исакова;София;Валерьевич;Граф № Людмила колокол;2008;642
Николаев;Алексей;Романович;Анна зори и без;1915;644
Садыхов;Валерия;Юрьевич;Лорна перевал хуторе чудес;1890;986
Игнатьев;Вадим;Алексеевич;Повести лет города;1927;711
Васильева;Никита;Николаевич;Автостопом Карамазовы гнездом клуба;1848;325
Нуртдинов;Никита;Разилевна;Мотылёк на богом;1889;501
Васильева;Игорь;Алексеевич;Драма градус фронте персик перемен;1909;892
Псурцев;Владимир;Батырович;Унесённые элефант и грядущего;1997;457
Васильева;Никита;Алексеевич;Медный тщеславия Брайдсхед его;1966;497
Феодосьев;Лада;Николаевич;Собака Шарлотты и ржи;1900;124
Лукашева;Анастасия;Игоревич;Благие и Твиста Кубок;2018;847
Базоева;Мирра;Михайлович;Маленький служанки Гарпа без;1971;101
Николаев;Станислав;Васильевич;Два лет Брайдсхед тихие;1914;506
Васильева;Даниил;Васильевич;Чужестранка Монте-Кристо терновнике кукушки;1921;255
Гаянов;Яков;Алексеевна;По ветром гнездом близ;1962;506
Амирханов;Андрей;Тамазович;Правда западном лье и;1869;820
Шкляев;Михаил;Дмитриевич;Хождение Стража! бытия Мезонинов Ливингстон;1868;621
Базоева;Алексей;Олегович;Кавказский оружию! и;1986;181
Аношин;Никита;Дмитриевич;Хайди на Пиквикского клуба 44-го);1857;871
Бурцев;Кристина;Алексеевич;Остров музыка дети дома;2015;944
Олефир;Василий;Вячеславович;Спокойной о гнездом платяной;1937;455
Попцова;Федор;Георгиевна;Гроздья по море без;2009;155
Савельичев;Гулабру;Дмитриевна;Пролетая начала мир людях;1841;700
Темурбекова;Очир;Игоревич;Американский отец Людмила не;1883;140
Васильев;Камилла;Александрович;Артемис миров Форсайтах не;1897;609
Гребнев;Анастасия;Бакытбековна;Портрет Оливера охоте людях 44-го);2009;446
Прокопенко;Михаил;Евгеньевна;Мемуары Шерлока Юность рая;1890;116
Бекетова;Евгения;Федорович;1984 жнец наказание Джонатан;1953;483
Масликов;Евгений;Александрович;Вещие надежды охоте;1879;682
Шевцев;Карам;Игоревич;Вечера сокровищ мертвые;2006;509
Никитина;Кира;Александрович;Чайка тщеславия шоколадная оружию!;2004;664
Копытин;Сергей;Николаевна;Волхв в море Прометей перемен;1942;403
Галкин;Артем;Дмитриевич;Маленький Степанчиково и без огня;1998;425
Минубаев;Павел;Дмитриевич;Цвет пленник рода;1973;642
Пучко;Яна;Талантбековна;Рудин паруса Джонс колокол;1945;971
Толмачева;Елена;Александровна;Осиная тщеславия Холмса городах;1976;770
Таранченко;Дарья;Вячеславович;День Пух время оружию!;1904;226
Колесников;Марк;Георгиевна;Роковая тьмы Богоматери;1942;895
Нечаев;Дарья;Федорович;На сад мир;1894;44
Нечаев;Даниил;Сергеевна;Противостояние № Большой не;1897;404
Егорова;Полина;Андреевич;Три из подполья Кубок считая;1872;134
Сильвентойнен;Никита;Андреевич;Оно Поттер К чудес;1896;491
Баринова;Андрей;Алексеевич;Мартин и времени его;1941;227
Гридасов;Никита;Максимовна;Пиковая Бриджит богом Прометей;1953;886
Зырянов;Эльдар;Владимирович;Горе Иден Командир персик добрый;1897;95
Черепанова;Илья;Георгиевна;Трое морей: и грядущего;1919;205
Грибкова;Дмитрий;Михайлович;Старик сердце имени грядущего перемен;1875;440
Сабитов;Никита;Анатольевна;Золотой и наказание и;1873;280
Батурин;Бегимай;Вагабович;Кавказский или фронте и;2008;337
Селиванова;Максим;Сергеевич;Лев, пересмешника Туда персик;1931;932
Грибкова;Полина;Дмитриевич;Роковая рассказы любовники;1936;613
Шлянов;Егор;Олегович;Эмма западном охоте колокол;1992;668
Блюм;Карам;Романович;Старик сердце Зеленых его;1879;607
Молодых;Екатерина;Игоревич;Кавказский об допоздна Мезонинов;2003;522
Молодых;Валерия;Юрьевич;Девчонки и (В рая;1895;989
Грибкова;Дмитрий;Артемович;БДВ, в лодке, рая;1937;873
Селиванова;Никита;Валерьевич;Бег колдунья море тихие Азкабана;2017;503
Бекетова;Илья;Олеговна;Лето отец и мир;1987;433
Дегтярев;Бегимай;Викторовна;Казаки Тома море рая обитатели;1964;89
Черноиванова;Сергей;Александровна;Черный человека К Кубок;1862;190
Копытин;Валерия;Сергеевич;Доводы сад одиночества Том шкаф;1932;352
Панов;Вадим;Сергеевич;Уловка-22 или Юность философский;2018;613
Девяткин;Григорий;Сергеевна;Пятый из терновнике;2008;659
Зырянов;Никита;Владимирович;Повести теленок гигантский Мини;1940;844
Шишкин;Юрий;Бакытбековна;Возвращение Крузо Смерти августе;1858;434
Рубайко;Мария;Игоревна;Лев, и Брайдсхед;1912;903
Колесников;Айдана;Гумаровна;Эмма Дун К оружию!;1901;935
Галиева;Юрий;Андреевич;Аня тьмы гнездом его;1886;429
Марков;Илья;Алексеевна;Алиса начала Маргарита;1940;936
Быковский;Николай;Вячеславовна;Волхв ученик фронте дома комната;1854;238
Таранченко;Андрей;Николаевич;Сто дивный имени;1899;167
Солдатов;Камилла;Тимуровна;Собачье в оскорблённые;2018;386
Базоева;Виктор;Петрович;Мир записки границей дома;1968;577
Васильева;Софья;Руслановна;Детство. нашего допоздна без;1929;787
Зайнутдинова;Евгения;Даниловна;Руслан и (В августе;1913;272
Молодых;Георгий;Дмитриевич;Стража! сад и;1941;261
Любимов;Дмитрий;Андреевич;Мартин реки границей;1922;965
Пена;Дмитрий;Намигович;Уловка-22 ветром мистер без комната;1964;241
Коште;Эдуард;Сергеевич;Ревизор рассудка предубеждение и;1951;691
Шишкин;Елена;Рафиковна;А Гэтсби Пиквикского клуба 44-го);1871;743
Люкшин;Александр;Валерьевич;Граф в Грея Кубок;1926;469
Хахарова;Игорь;Даниловна;Джейн тысяч богом кукушки;1891;252
Кузнецова;Николай;Эльханович;Анна принц одиночества его;1982;247
Шмелев;Софья;Георгиевна;Сёгун по подполья под;1841;750
Перетятько;Мария;Григорьевич;Три новости мир Том;1954;59
Васильев;Алексей;Гаряевич;Дневник волшебства Лис Тайная;1974;450
Куулар;Булат;Александрович;Дядя и допоздна грядущего;1973;436
Копытин;София;Гаряевич;Записки из шоколадная;2008;529
Кузнецова;Анна;Гумаровна;Лев, музыка Командир и перемен;1996;215
Васильев;Никита;Дмитриевич;Золотой тысяч ивах чудес добрый;1950;925
Дьячкова;Элина;Витальевич;К за рода и;2010;292
Коште;Дамир;Артемович;Убить капитана Сойера под;1872;892
Джинчарадзе;Бегимай;Максимовна;А волшебства Современный людях водой;1942;573
Перетятько;Михаил;Станиславович;Пролетая лёгкость мертвые и;1875;158
Исакова;Антон;Алексеевич;Маленькие лёгкость мир платяной добрый;1860;794
Зубенок;Виталий;Алексеевич;Волшебник Санникова и рая;1944;319
Сорокин;Карам;Андреевич;Над по Холмса мир;1865;955
Немна;Арина;Васильевич;Подросток Ваня мистер;1898;66
Егорова;Мирра;Владимирович;1984 Онегин оскорблённые;1879;133
Кузнецова;Григорий;Ильсеярович;Два от Людмила и;1929;652
Немна;Алиса;Ильсеярович;Левша быть подполья грядущего;1913;985
Сабитов;Долума;Валерьевич;Крестный и Брайдсхед;2009;762
Черепанова;Игорь;Даниловна;На мушкетера наказание д’Эрбервиллей;1950;780
Мансуров;Николай;Иванович;Таинственный Санникова во городах водой;1840;660
Ефимов;Алексей;Георгиевна;Гроздья холмов одиночества августе;1916;871
Марков;Павел;Карамалиева;Пётр Крузо рода Мезонинов Диканьки;1843;496
Харисова;Юлия;Валерьевич;Повесть двор и и добрый;1889;929
Савченко;Анна;Андреевна;Игрок об от Тайная;1875;678
Блюм;Регина;Ильинична;Ревизор и мир и;1867;991
Чернов;Анна;Альбертович;В музыка К философский штурман;1936;533
Масликов;Дмитрий;Дмитриевна;Хозяин Гэтсби и кукушки камень;1963;486
Хмелев;Дмитрий;Николаевич;Преступление Монте-Кристо Лис Мини;1950;942
Феодосьев;Павел;Георгиевич;Цвет Каренина подполья городах перемен;1865;171
Жмурин;Виктор;Алексеевна;Село товарища Богоматери августе;1840;578
Марков;Дарья;Витальевич;Чайка или Богоматери Мезонинов перемен;1870;897
Шагимарданова;Лука;Гаряевич;Зеленая Тома и Джонатан Диканьки великан;1919;409
Куликова;Булат;Игоревич;Дубровский служанки Лис колокол;1894;404
