Баринов;Максим;Иванович;Чайка Шерлока здесь Прометей штурман великан;1850;228
Вирютин;Софья;Сергеевич;Герой из лодке, Том;1979;632
Швырев;Долума;Георгиевна;Пролетая Парижской Маргарита;1971;810
Осипов;Дарья;Гумаровна;Корабельные и имени ржи комната;1980;234
Селиванова;Вадим;Михайлович;Тэсс и рода под обратно;1840;892
Бурцев;Георгий;Михайлович;Правда и ивах без перемен;1903;220
Хахарова;Максим;Талантбековна;Дэвид психопат чердаке фабрика;2020;299
Васильев;Дмитрий;Гаряевич;Хоббит, Иден охоте кукушки Диканьки;1911;808
Коряков;Никита;Руслановна;Братья градус мир ржи;1853;147
Перетятько;Елена;Дмитриевич;Севастопольские знамения врача Фаренгейту;2003;803
Пинаев;Софья;Тамазович;Чужестранка или Пиквикского не водой;1952;455
Чертова;Артём;Дмитриевич;Записки Белкина Форсайтах городах;1881;659
Андреев;Камилла;Дмитриевна;Анна Монте-Кристо Людмила городах;1972;91
Гребнев;Дмитрий;Борисович;Изумительный миля города Джонатан;1856;292
Таранченко;Иван;Георгиевич;Алые над Людмила чудес;1935;905
Петров;Яков;Дмитриевич;Рассказы рассудка подполья;1902;817
Швырев;Магомед;Андреевич;Волхв ветром подполья;1940;989
Лукашева;Эльфат;Карамалиева;Правда Шакала терновнике Тайная;1937;118
Зубенок;Гордей;Олеговна;Автостопом Степанчиково звонит грядущего Ливингстон;1969;516
Бикушев;Алексей;Евгеньевна;Хаджи-Мурат Монте-Кристо и ржи Ливингстон;1942;349
Сайфуллина;Сергей;Владимирович;Тёмные Каренина лье д’Эрбервиллей Азкабана;1992;612
Гребнев;Елена;Георгиевна;Приключения № Мёртвого Мезонинов;1875;372
Антонов;Артём;Андреевна;Пляж Дун время Тайная;1861;836
Прокопенко;Юлия;Тамазович;Три Бульба и оружию! добрый;1949;111
Любимов;Виктория;Сергеевич;Старик Софии Сойера грядущего обитатели;1961;451
Нуртдинов;Артем;Алексеевна;К паруса во Кубок добрый;1912;234
Шпак;Георгий;Хусниддиновна;Три и мир не;1965;517
Волох;Илья;Равкатовна;На Степанчиково Оуэне;1898;925
Галиева;Никита;Марсовна;Ревизор ночи, Холмса оружию! Диканьки;1849;33
Копытин;Лука;Вячеславовна;Холодный фабрика двух августе Диканьки;1914;815
Шкляев;Валерия;Максимовна;Мёртвые ночи, и августе перемен великан;1888;668
Любимов;Элина;Денисович;Гарри Шакала допоздна близ;1970;28
Андреев;Валерия;Александровна;Ветер волшебства Богоматери дома камень собаки;1890;915
Перетятько;Камилла;Георгиевич;Приключения из шоколадная городах перемен;1852;277
Галиева;Эльфат;Дмитриевич;Живые Васильевич терновнике не;1951;803
Старшинов;Дмитрий;Тамазович;Вор души и ржи;1880;166
Жмурин;Софья;Николаевна;Джеймс из;1979;223
Аношин;Таисия;Гаряевич;Властелин во чердаке фабрика добрый;1918;556
Шпак;Никита;Михайлович;Идиот Фаул звонит колокол;2013;210
Немна;Дамир;Александрович;Таинственный Отрочество. и Том;1931;624
Потемкин;Роман;Олеговна;1984 в Зеленых Фаренгейту шкаф;1887;738
Базоева;Максим;Гумаровна;Американский перевал границей холеры;1904;192
Гаянов;Егор;Станиславовна;Записки и двух мир;1850;240
Быковский;Илья;Дмитриевна;Сто или Брайдсхед не;1921;31
Хмелев;Данил;Ришатович;Мир и оскорблённые без обитатели;2016;138
Андреев;Александр;Владимировна;Маленький лёгкость Грея под;2013;377
Чертова;Николай;Константинович;Мир капитана галактике и;1932;761
Кобякова;Кирилл;Равкатовна;Рудин в и клуба;1876;487
Люкшин;Егор;Андреевич;Бедные мистер Гарпа грядущего;1859;844
Дегтярев;Василий;Михайловна;День от одиночества холеры перемен;1982;131
Кузнецова;Елена;Тимуровна;Алиса колдунья здесь;1984;733
Чернов;Алексей;Георгиевич;На в предубеждение под;2009;758
Пена;Георгий;Павлович;На Фаул Сойера персик;1881;193
Потемкин;Александр;Алексеевич;Гарри о Туда философский обитатели собаки;1861;274
Хахарова;Даниэлла;Михайлович;451 глазами Богоматери;1849;664
Пена;Роман;Витальевич;Алхимик Иден мукам Мини Диканьки;1989;792
Козырева;Никита;Максимовна;Дракула градус одиночества и;1898;377
Алишерова;Даня;Хусниддиновна;Приключения и Юность не;1954;147
Клянчин;Екатерина;Андреевна;Джейн розы гнездом Прометей;1905;376
Нуртдинов;Мирра;Александрович;Судьба по гнездом оружию!;1939;981
Дегтярев;Валерия;Алексеевна;Любовь мистер звонит августе;1881;530
Алишерова;Бегимай;Васильевич;Рождественская юного Современный людях;1870;24
Кирьянов;Алексей;Николаевич;Анна в оскорблённые;1923;646
Олефир;Георгий;Владимирович;Анна дом обочине Мини;2001;307
Черепанова;Долума;Николаевич;Ветер Софии море августе огня;1855;408
Шевцев;Виктор;Андреевич;О истины фронте холеры Азкабана;1910;74
Антонов;Дарья;Алексеевич;Судьба Баскервилей гнездом холеры;1901;75
Шишкин;Малик;Вадимович;Грозовой и гигантский Фаренгейту;1944;211
Грибкова;Эльдар;Александровна;Повелитель Незаметный море чудес;1899;506
Галиева;София;Александрович;Мастер Кэстербриджа Брайдсхед персик перемен;1864;981
Шарова;Анна;Андреевич;Пролетая быть и ржи;1994;301
Борисова;Регина;Витальевич;Борис по мертвые платяной шкаф;1978;727
Гридасов;Дарья;Алексеевич;Братья мистер Богоматери ржи;2016;908
Дегтярев;Роберт;Николаевна;Гарри Дик обочине Тайная шкаф;1963;716
Быковский;Игорь;Талантбековна;Старик над Зеленых Прометей;1849;396
Балинова;Виктория;Андреевна;Божество тьмы двух и;1942;795
Молодых;Даниил;Валерьевна;Преступление Бриджит Лис Мезонинов;1998;635
Таранченко;Федор;Александрович;Белая из и мир;1906;914
Чертова;Георгий;Валерьевич;Повести гнездо Зеленых;1945;634
Салдусов;Егор;Александровна;Обломов всадник Грея ржи Ливингстон собаки;1968;766
Кирьянов;Виктория;Равкатовна;Преступление полуночи подполья августе водой;1924;840
Быковский;Гулабру;Денисович;Горменгаст Бульба наказание и;1979;574
Александров;Дмитрий;Эдуардовна;Пиковая Отрочество. дети грядущего добрый;1963;537
Васильев;Роберт;Батырович;Артемис Софии обочине Прометей;2002;80
Жмурин;Глеб;Валерьевич;К начала наказание оружию!;1843;742
Шпак;Булат;Станиславович;К Поттер Современный под;1947;404
Копытин;Кира;Евгеньевна;Холодный Оливера от мир обитатели;1891;381
Гусейнли;Кирилл;Владимирович;Записки служанки море платяной огня;2013;433
Перетятько;Никита;Игоревич;Пролетая Фаул терновнике холеры;2012;245
Галиева;Михаил;Олегович;Вечера мышах Маргарита философский;1900;408
Шагимарданова;Эдуард;Александровна;Воскресение Санникова Мёртвого Фаренгейту;1940;969
Васильева;Анна;Валерьевич;Крестный и во Том перемен;1966;156
Нуртдинов;Алексей;Сергеевна;Казаки гнева Маргарита узник шкаф;1867;29
Грибкова;Никита;Михайлович;Анна тысяч и чудес Ливингстон;1913;85
Нуртдинов;Андрей;Николаевич;Записки волшебства и;1863;389
Лукашева;Александр;Дмитриевич;Золотой об Холмса и;1840;653
Васильев;Карам;Игоревич;Гроздья охотника подполья философский;1922;35
Черепанова;Гордей;Олегович;Сёгун Бриджит Зеленых персик 44-го);1985;551
Хмелев;Александр;Ильинична;Село по Твиста узник;1913;906
Шишкин;Артемий;Николаевич;Преступление арка и платяной огня;2006;621
Муханов;Регина;Александрович;Поющие Дон Холмса оружию!;1950;337
Игнатьев;Илья;Владимирович;Три Монте-Кристо Туда дома огня;1845;790
Кузнецова;Илья;Валерьевна;Маленький Белкина Смерти клуба;1900;734
Кобякова;Даниил;Иванович;Холодный арка наказание;1955;35
Торжков;Георгий;Олегович;Столпы теленок Маргарита персик перемен;1925;501
Щербаченко;Айдана;Вячеславович;Хоббит, Бульба и без;1973;836
Хахарова;Артем;Максимович;Земля рассудка фронте д’Эрбервиллей считая;1924;872
Таранченко;Николай;Викторовна;Рассказ арка бытия грядущего перемен;1955;407
Никитин;Вадим;Гумаровна;Повести Онегин чердаке его считая;1899;224
Батурин;Полина;Михайловна;Двенадцать принц гнездом и;1972;440
Глазачев;Роберт;Владимирович;Хозяин Шарлотты Зеленых ржи обитатели;1861;612
Собко;Анастасия;Алексеевич;БДВ, миров Лис городах;1993;351
Торжков;Кристина;Рамильевич;Стража! Сергий города мир водой;1922;186
Алексанов;Игорь;Олеговна;Война триффидов и Фаренгейту;1986;563
Пена;Элеонора;Васильевич;Преступление Гекльберри богом и;1847;31
Ефимов;Лада;Станиславовна;Остров от шоколадная Прометей;1926;860
Андреев;Марк;Васильевич;Американский Эйр и;1844;316
Земчик;Георгий;Хусниддиновна;Эмма в К холеры;2002;208
Усманов;Алексей;Максимовна;Артемис и предубеждение людях огня;1863;575
Солдатов;Данил;Олегович;Горменгаст двор терновнике холеры;1978;300
Ткаченко;Дмитрий;Васильевич;Над Дун богом колокол обитатели;1918;161
Черепанова;Дмитрий;Станиславович;Преступление Незаметный и клуба комната;1915;52
Масликов;Анна;Михайлович;Дворянское Софии времени колокол штурман;1903;356
Иванова;Алмаз;Алексеевич;Обитатели и море ржи;1875;160
Баринова;Глеб;Александровна;Властелин из Современный и водой;1933;236
Нуртдинов;Александр;Сергеевна;Старик на оскорблённые Прометей камень;1955;530
Бескровная;Андрей;Вячеславович;О теленок;1986;591
Собко;Валерия;Александровна;Противостояние времени Пиквикского Кубок водой;1968;543
Савельичев;Лука;Андреевич;Воскресение Дик и рая;1867;756
Грибкова;Иван;Вячеславовна;Вишневый дороге и Тайная шкаф;1926;598
Коште;Анна;Владимирович;Доводы и галактике платяной;1970;548
Бикушев;Алексей;Иванович;Джуд и Сойера людях Азкабана;1935;577
Николаев;Артем;Рафиковна;В птиц и узник Диканьки;1896;627
Олефир;Долума;Марсовна;Сыновья миля дети холеры;1986;947
Джинчарадзе;Георгий;Анатольевна;Дэвид от богом людях перемен;2004;355
Иванова;Софья;Дмитриевич;Драма нашего Твиста;1840;207
Нуртдинов;Николай;Карамалиева;Мастер сокровищ границей фабрика перемен;2009;945
Бурцев;Валерия;Владимировна;Франкенштейн, и время;1960;36
Амирханов;Бегимай;Гаряевич;Золотой об Юность городах перемен;1950;888
Осипов;Регина;Александрович;Ведьмы за (В Джонатан;1902;623
Агашкина;Александр;Айдаровна;Маленький игле врача Фаренгейту;1849;484
Старшинов;Ангелина;Федорович;Сто капитана богом ржи Азкабана;1904;530
Игнатьев;Дарья;Борисович;Винни принц и д’Эрбервиллей;1959;71
Нуртдинов;Анна;Анатольевна;Борис Копперфильд и холеры;1985;254
Амирханов;Глеб;Марсовна;Пролетая западном врача персик 44-го);1921;49
Хмелев;София;Евгеньевна;Посмертные востоку гигантский мир огня;1989;933
Строкин;Андрей;Вагабович;Граф обелиск и людях;1939;70
Теслюк;Магомед;Георгиевна;Пролетая гнева новый Тайная;2015;116
Садофьев;Лука;Дмитриевич;Анна Дориана по;2017;397
Колесников;Юлия;Равкатовна;Спокойной жнец и чудес огня;1933;231
Романовский;Арина;Михайлович;Чужестранка колдунья Оуэне и огня;1868;645
Галиева;Даниил;Юрьевич;Севастопольские сад гнездом холеры;1852;269
Романовский;Виталий;Сергеевна;Доводы Дик хуторе;2016;40
Шарова;Владислав;Олеговна;Старик розы К;1859;264
Попцова;Валерия;Павлович;Властелин женщины города персик;1849;777
Попцова;Иван;Александровна;Hi-Fi и от людях комната собаки;1995;587
Пена;Евгений;Ильинична;Убить и (В ржи перемен;1983;217
Куулар;Юрий;Вячеславовна;Фауст принц ивах без;1858;675
Шлянов;Яков;Константинович;Дракула тьмы Холмса рая;1949;701
Немна;Александр;Максимович;Чужестранка колец времени дома;1888;411
Прокшин;Арина;Евгеньевна;К или от Фаренгейту;1962;601
Словеснов;Егор;Романович;Лолита Первый терновнике;1847;629
Агашкина;Иван;Викторовна;Возвращение в Холмса Тайная;1841;500
Шевцев;Марк;Михайлович;Хоббит, мушкетера Пиквикского августе;2015;780
Шарова;Анастасия;Николаевич;Большие во Твиста Мини шкаф;2017;856
Феодосьев;Даниил;Николаевич;Белый пересмешника мистер и;1876;151
Исакова;Элина;Николаевна;Ярмарка по обочине и штурман;1998;847
Щербаченко;Лада;Сергеевич;Пение Эйр лодке, Тайная камень;1966;59
Шехтер;Георгий;Вагабович;На пленник Пиквикского;1892;620
Лобань;Мария;Дмитриевна;Грозовой двор мир д’Эрбервиллей;1900;316
Никитин;Дмитрий;Вячеславович;Три или новый холеры;1980;704
Лукашева;Игорь;Игоревич;Возвращение лет города платяной;2008;812
Строкин;Алексей;Талантбековна;Три Дик гигантский клуба обитатели;1991;576
Таранченко;Андрей;Рафиковна;Пение стульев бытия персик Азкабана;1890;349
Андреев;Лада;Николаевич;Столпы жнец ивах холеры добрый;1893;589
Гридасов;София;Дмитриевна;Правда сердце К;1893;125
Гридасов;Дарья;Олегович;Вишневый мистер море и;1871;408
Никитин;Анастасия;Михайловна;Униженные сестры предубеждение кукушки камень;1961;766
Нуртдинов;Владислав;Алексеевна;Невыносимая дороге Маргарита холеры;1952;790
Садофьев;Николай;Витальевич;Бедные лёгкость мертвые;1941;338
Прокопенко;Георгий;Юрьевич;Солярис Гекльберри допоздна;1906;633
Молодых;Павел;Исламовна;Мастер сестрички дети его Азкабана;1969;343
Грибкова;Алиса;Андреевич;Рассказ Отрочество. (В Прометей комната;1928;913
Зубенок;Артем;Станиславович;Капитанская стульев Твиста Том перемен;1848;344
Феодосьев;Ангелина;Михайлович;Подросток обелиск и платяной;1965;474
Алексанов;Юлия;Максимовна;Большие принц дети ржи;1957;785
Марков;Юлия;Евгеньевна;Собака мух дети платяной огня;2018;980
Васильева;Арина;Олегович;Отец гнева наказание Мезонинов;2015;189
Аношин;Симон;Юрьевич;Сердце и хуторе;1988;745
Шлянов;Лука;Ильинична;Пётр триффидов и фабрика;1935;451
Немна;Андрей;Алексеевна;Сто миров здесь фабрика;1976;932
Попцова;Павел;Алексеевич;Ветер сад и платяной перемен;1911;435
Спирин;Владислав;Сергеевич;Таинственный игле Богоматери чудес;1893;290
Сильвентойнен;Элеонора;Вадимович;Повесть и любовники кукушки перемен;1933;637
Шкляев;Павел;Денисович;Игрок пленник дети кукушки;1955;904
Москаленко;Илья;Тимуровна;Пролетая Каренина Пиквикского близ;1869;516
Дьячкова;Илья;Равкатовна;Гарри Монте-Кристо гнездом;1973;752
Прокопенко;Булат;Дмитриевна;Девчонки женщины по кукушки шкаф;1913;183
Пучко;София;Михайловна;Тихий начала Командир рая штурман;1955;288
Никитина;Юлия;Витальевич;День или Джонс Джонатан Ливингстон;1960;255
Петров;Александр;Вагабович;Ведьмы жнец чердаке узник водой;1900;770
Быковский;Магомед;Алексеевна;Доводы западном границей;1967;421
Рубайко;Гулабру;Альбертович;Чайка пленник хуторе фабрика Азкабана;1941;643
Чертова;Алексей;Валерьевич;Винни и Брайдсхед;1912;578
Джинчарадзе;Елена;Григорьевич;Девчонки о Богоматери близ;1861;365
Масликов;Валерия;Константинович;Собачье элефант 6 его Ливингстон;1921;576
Шехтер;Лука;Сергеевич;Стража! Пух 6 кукушки;2019;572
Потемкин;Кира;Алексеевич;Маленький и одиночества холеры камень;1938;412
Ефимов;Сергей;Сергеевна;Земля и города близ штурман;1979;945
Власенко;Вадим;Васильевич;Горменгаст принц Современный Мезонинов;1862;766
Москаленко;Иван;Талантбековна;Иван миров дети;1952;493
Померанцев;Алиса;Александрович;День Степанчиково города кукушки;1912;29
Тихонов;Марк;Михайлович;Повелитель принц по под;1950;120
Копытин;Даня;Тимуровна;Винни женщины одиночества колокол;1929;18
Швырев;Дмитрий;Тимуровна;Маленькие по здесь;1858;532
Швырев;Артемий;Александрович;Скотный в и Кубок;1948;313
Борисова;Юлия;Вячеславович;Властелин Иден новый кукушки;1989;892
Чинилов;Галина;Александровна;Анна глазами и платяной огня;1860;551
Хахарова;Булат;Владимировна;Дневник тысяч Зеленых тихие огня;1914;124
Копытин;Арина;Павлович;Рождественская Степанчиково Зеленых Мини комната;1924;290
Бикушев;Артём;Николаевич;Записки пропастью времени Прометей;1866;701
Дегтярев;Дарья;Альбертович;Портрет быть границей Джонатан;1957;724
Клянчин;Мария;Дмитриевна;Скотный мышах Пиквикского кукушки;1862;123
Грибкова;Андрей;Тамазович;День Незаметный лодке, д’Эрбервиллей шкаф;1979;798
Люкшин;Магомед;Игоревич;Преступление сад границей персик;1957;596
Шарова;Михаил;Романович;Воскресение ШКИД Богоматери Мини;1852;383
Шмелев;Даниил;Анатольевна;По сад чердаке холеры;1984;895
