Пена;Таисия;Игоревич;Эмма Изумрудного подполья;1851;93
Потемкин;Михаил;Талантбековна;Обломов товарища Зеленых близ шкаф;1924;201
Николаев;Роман;Витальевич;Чарли Тома во чудес Ливингстон;2010;164
Шлянов;Евгения;Федорович;Борис принц галактике;1914;32
Гусейнли;Данил;Николаевич;Джейн глазами одиночества не штурман;1872;541
Дьячкова;Малик;Андреевич;Возвращение арка (В и 44-го);1904;36
Алексанов;Виталий;Алексеевна;Пётр Пух имени фабрика;1907;646
Шестопалов;Дария;Григорьевич;Тарас Бриджит К кукушки перемен;1865;290
Кузнецова;Дамир;Валерьевич;Дворянское Шарлотты гигантский мир;1895;625
Романовский;Юлия;Александровна;Кавказский зори Современный колокол;2020;621
Власенко;Анна;Ришатович;Молитва мушкетера и его;1977;356
Померанцев;Роберт;Андреевич;Республика паруса Зеленых Джонатан огня;2019;86
Галиева;Александр;Федорович;Поющие и мир холеры Ливингстон;1972;864
Сорокин;Айдана;Александровна;Властелин Поттер мертвые платяной;2017;109
Лилина;Эльдар;Максимовна;Три служанки по холеры;2017;415
Темурбекова;Илья;Сергеевич;Благие знамения дети персик;1970;657
Садофьев;Булат;Максимовна;Тихий капитана во и Диканьки;1984;132
Пена;Анастасия;Андреевич;Медный Белкина Джонс;1890;68
Николаев;Илья;Георгиевна;Сто Шакала время холеры;1984;316
Зырянов;Юлия;Сергеевич;Большие стульев времени его;1909;149
Дегтярев;Дарья;Витальевич;Анна морей: одиночества;1877;793
Тихонов;Марк;Дмитриевич;Село Каренина звонит его;1922;304
Теслюк;Никита;Вадимович;Ким принц фронте философский;1956;377
Садофьев;Николай;Батырович;Стража! мух Зеленых кукушки Азкабана;1924;131
Тихонов;Алексей;Романович;Американский полуночи К;1978;619
Александров;Эдуард;Ильдарович;Преступление Изумрудного лье Фаренгейту;1862;437
Чинилов;Юлия;Романович;Таинственный Поттер море персик;1899;68
Исакова;Евгения;Андреевна;Поющие обелиск К;1999;473
Попцова;Виктория;Евгеньевна;Рассказ полуночи Маргарита оружию!;1916;183
Любимов;Василий;Игоревна;Мрачный Монте-Кристо Оуэне и;1895;344
Гаянов;Гулабру;Константинович;Игрок знамения Финна его водой;1915;971
Быковский;Яков;Алексеевна;О Дик Стране;1895;75
Сорокин;Артём;Ришатович;Лето западном Маргарита клуба;1955;482
Чернов;Александр;Вячеславович;Приключения из Стране и;1909;547
Новиков;Эльдар;Андреевич;Земля всадник Современный;2005;109
Чернов;Илья;Геннадьевна;Доктор тьмы мир;1973;115
Кирьянов;Полина;Валерьевич;Доводы Сергий Маргарита без;1848;21
Савельичев;Даня;Дмитриевна;Грозовой Господне время людях;1923;839
Шарова;Валерия;Эдуардовна;Алые лёгкость гигантский Том камень;1914;473
Бурцев;Иван;Константинович;Собака и оскорблённые;1981;131
Коште;Елена;Федорович;Два рассказы ивах без Азкабана;1911;954
Шестопалов;Наталия;Николаевич;К Иден ума грядущего добрый;1914;827
Алексанов;Елена;Андреевич;Человек-амфибия в Холмса рая камень;1948;846
Алексанов;Анна;Валерьевна;Алиса и и мир;1968;838
Галкин;Михаил;Батырович;Франкенштейн, принц 6 холеры обитатели;1847;678
Сорокин;Анна;Эдуардовна;О миля города и считая;2002;705
Шевцев;Георгий;Васильевна;БДВ, ветром имени;1882;186
Торжков;Очир;Алексеевич;Тёмные и дети чудес;2011;901
Кирьянов;Игорь;Максимович;Пётр Поттер границей Мини;1950;672
Немна;Наталия;Алексеевна;Ким над Гарпа;2017;946
Бекетова;Владислав;Ильдарович;Стража! Эйр Лис кукушки шкаф;1860;536
Кирьянов;Алексей;Константинович;Портрет птиц подполья Фаренгейту;1951;195
Кирьянов;Яна;Бакытбековна;Моби ком мукам не;1949;803
Строкин;Виталий;Александрович;Белый души наказание дома комната;1902;871
Москаленко;Анастасия;Владимирович;Портрет принц оскорблённые;1952;272
Кудрявцева;Екатерина;Васильевич;Вечера и Пиквикского Джонатан;1846;645
Фроловичев;Никита;Равкатовна;Двадцать Онегин Командир его перемен;1941;495
Осипов;Екатерина;Михайловна;Граф капитана 6 колокол;1964;359
Хмелев;Павел;Павлович;Гроздья по и городах;1962;418
Куликова;Артем;Владимирович;Трое колец границей без штурман;1962;849
Шевцев;Михаил;Карамалиева;Медный Фаул богом и;1989;965
Хахарова;Илья;Игоревна;Морфий перевал Форсайтах Мезонинов считая;1952;620
Спирин;Роберт;Игоревич;Властелин рассудка Холмса августе считая;1939;401
Хангильдин;Магомед;Алексеевна;Дядя Клык и и;2020;936
Антонов;Марк;Николаевич;Повелитель былого Смерти Кубок 44-го);1854;462
Васильева;Георгий;Даниловна;Повесть Живаго наказание его комната;1881;790
Рубайко;Валерия;Игоревич;Мастер перевал К без;1895;373
Блюм;Таисия;Андреевич;Любовь на Брайдсхед Фаренгейту;1947;860
Спирин;Гордей;Разилевна;Сто сад здесь философский;1971;132
Марков;Юлия;Сергеевич;1984 ветром города персик;1948;984
Аношин;Артём;Евгеньевна;Хайди и ивах рая добрый;1924;368
Никитина;Данил;Олеговна;Морфий Дориана 6 кукушки огня;2016;764
Пена;Юлия;Александрович;Мор, ШКИД Командир грядущего;1932;197
Дегтярев;Виктор;Равкатовна;Республика тщеславия звонит без;1851;83
Безель;Александр;Юрьевич;Алхимик от море;1927;774
Баринова;Роберт;Сергеевич;Обитатели холмов города платяной;1883;285
Безель;Александр;Гумаровна;Гарри над предубеждение без;1915;331
Швырев;Алиса;Борисович;Подросток Крузо гнездом рая Азкабана;1980;634
Быковский;Михаил;Дмитриевич;Рассказ по любовники и;1865;703
Куликова;Максим;Сергеевна;Пение начала во Кубок;2016;564
Козырева;Владислав;Дмитриевич;Дворянское из и;1906;387
Черноиванова;Илья;Алексеевна;Двадцать и и оружию! перемен;1900;985
Салдусов;Мирра;Разилевна;Корабельные игле города Тайная комната;1845;674
Бикушев;Константин;Игоревна;Чайка лет наказание платяной;1916;852
Немна;Софья;Сергеевич;Алиса человека звонит оружию!;2018;931
Новиков;Данил;Геннадьевна;Пётр оружию! терновнике;1895;403
Кузнецова;Элеонора;Вадимович;На дороге имени грядущего;1930;564
Люкшин;Владимир;Григорьевич;Драма и новый кукушки 44-го);1889;888
Александров;Станислав;Альбертович;Божество в лодке, фабрика;1952;660
Куликова;Михаил;Равкатовна;451 Санникова наказание Кубок Ливингстон;1949;926
Шестопалов;Лука;Георгиевич;Вещие птиц шоколадная;1867;36
Сайфуллина;Наталия;Дмитриевич;Белая об море близ шкаф;1884;918
Кузнецова;Роман;Константинович;Маленькие из гнездом чудес камень;1844;811
Хайрутдинова;Дмитрий;Георгиевна;Бесы души мир городах;2012;507
Куликова;Николай;Ильдарович;Триумфальная оружию! Командир клуба камень;1849;172
Аношин;Данил;Борисович;На дочка двух Кубок перемен;1996;173
Дегтярев;Долума;Васильевич;Пиковая дом и и комната;1958;927
Бикушев;Иван;Руслановна;Горе на мукам мир перемен;1975;379
Зайнутдинова;Алмаз;Эльханович;Мрачный Дик богом без;1892;530
Прокшин;Дария;Вадимович;Приключения Поттер мир близ считая;1841;347
Петров;Мария;Владимирович;Гордость за и людях;1948;83
Васильева;Алексей;Романович;Портрет новости Маргарита;1866;959
Шпак;Эльфат;Александрович;Остров Шерлока ивах Кубок Диканьки;1904;430
Галиева;Арина;Алексеевич;Севастопольские градус чердаке;2007;854
Псурцев;Марк;Михайловна;Франкенштейн, из одиночества д’Эрбервиллей;1847;865
Бурцев;Дмитрий;Ришатович;Сыновья или богом без считая;1862;165
Псурцев;Анастасия;Константинович;Триумфальная от подполья фабрика;1941;199
Панов;Евгения;Романович;Трудно колец Грея тихие обратно;1973;563
Теслюк;Станислав;Васильевич;Иван боги лье Тайная Диканьки;1861;591
Перетятько;Лука;Владимирович;Мор, знамения Большой и Ливингстон;1913;443
Кирьянов;Егор;Алексеевич;К Клык охоте;1919;991
Старшинов;Иван;Сергеевич;Хаджи-Мурат дочка границей;1953;330
Савельичев;Иван;Викторовна;Медный колдунья лье не;1980;684
Осипов;Юлия;Михайловна;Волхв пропастью Твиста колокол;2012;394
Темурбекова;Георгий;Андреевич;Грозовой Незаметный время кукушки;1842;189
Харисова;Карам;Геннадьевна;Большие Гекльберри Гарпа платяной;1972;154
Бездольный;Лука;Георгиевич;Аня пересмешника мир мир Диканьки;1890;585
Егорова;София;Олеговна;Цвет миров хуторе городах;2017;388
Хайрутдинова;Андрей;Алексеевна;Повести Живаго здесь;1991;808
Волох;Данил;Константинович;Доктор на гнездом;1890;622
Гребенкин;Арина;Ильдарович;Война глазами Маргарита Джонатан водой;1922;587
Салдусов;Бегимай;Равкатовна;Моби Эйр Людмила дома Диканьки;1995;954
Антонов;Михаил;Станиславовна;Божество гнева наказание Кубок обратно;1935;889
Панов;Яна;Рамильевич;Детство. в подполья близ;1959;680
Шкляев;Артемий;Талантбековна;Палата перевал наказание не;1951;51
Ефимов;Алексей;Альбертович;Солярис о любовники холеры;1962;501
Дегтярев;Михаил;Геннадьевна;Обломов миля Лис кукушки;1964;82
Немна;Кристина;Тамазович;Дневник над Туда рая;1942;107
Москаленко;Иван;Васильевна;Волхв сад здесь Кубок Ливингстон;1856;182
Егорова;Михаил;Эдуардовна;Цвет Эйр времени и;1966;32
Таранченко;Артем;Александровна;Доктор глазами от и;1863;923
Любимов;Арина;Артемович;Три глазами подполья ржи;1992;958
Кирьянов;Николай;Георгиевич;Бег всадник новый Мезонинов шкаф;1929;587
Глазачев;Илья;Анатольевна;Благие волшебства фронте;1890;769
Шестопалов;Арина;Константинович;Три гнева времени кукушки перемен;1881;778
Сильвентойнен;Сергей;Васильевич;Горменгаст арка Людмила оружию! обитатели;2021;378
Баринова;Галина;Викторовна;Отцы мистер гнездом Тайная Азкабана;1963;215
Козырева;Лада;Дмитриевич;Граф в врача клуба;1903;375
Немна;Роберт;Владимировна;Морфий знамения Финна близ;1890;845
Москаленко;Дмитрий;Игоревич;Пролетая в подполья узник;1915;296
Кудрявцева;Таисия;Георгиевна;На Иден Грея ржи штурман собаки;2019;626
Муханов;Роберт;Владимирович;Девчонки двор Гарпа тихие водой;1936;499
Бурцев;Карам;Алексеевич;Осиная гнева и колокол;1987;943
Зайнутдинова;Эльфат;Андреевич;Дюна и время;1913;420
Харисова;Владимир;Александровна;Чарли Монте-Кристо терновнике;2004;591
Феодосьев;Иван;Ильдарович;Бег о рода узник камень;1945;196
Клянчин;Арина;Максимовна;Записки ком Маргарита и;1893;168
Дегтярев;Максим;Андреевич;Ярмарка и Оуэне платяной;1841;27
Санджиев;Галина;Валерьевна;Солярис оружию! Твиста без;2014;460
Санджиев;Данил;Алексеевна;Божество жнец и Том;1996;624
Новиков;Арина;Михайловна;Корабельные на и под;2015;259
Усманов;Яков;Викторовна;Чайка Карамазовы Твиста без 44-го);1845;533
Нуртдинов;Никита;Станиславович;Драма мышах Брайдсхед Джонатан Ливингстон;1979;674
Алексанов;Виталий;Юрьевич;Анна по Людмила фабрика;1976;324
Чинилов;Никита;Юрьевич;Гарри жнец фронте его;1862;300
Александров;София;Сергеевна;Пляж полуночи лье Фаренгейту;1852;927
Шпак;Егор;Сергеевич;Приключения Оливера мир колокол обратно;1902;275
Торжков;Иван;Олегович;Трудно холмов ума;1884;271
Прокопенко;Долума;Михайловна;Унесённые рассудка и августе 44-го);2016;754
Амирханов;Алексей;Николаевна;Джеймс Тома и без;1890;677
Прокшин;Василий;Андреевич;Над Парижской предубеждение городах перемен;1967;330
Егорова;Анна;Константинович;Дядя рассудка здесь без;1961;455
Базоева;Дарья;Андреевич;Артемис или и людях обратно;2013;759
Лукашева;Василий;Михайлович;Хоббит, и и без;1924;383
Кудрявцева;Андрей;Гумаровна;Гарри Парижской море оружию! камень;2007;861
Егорова;Артемий;Игоревич;Ведьмы над двух чудес шкаф;2011;608
Милаева;Максим;Юрьевич;Земля или времени фабрика огня;1952;526
Чинилов;Артемий;Михайлович;Ведьмы служанки Грея Фаренгейту;1934;499
Жмурин;Анастасия;Павлович;Сто истины фронте Прометей;1852;572
Феодосьев;Владислав;Айдаровна;Ребекка Поттер одиночества философский обитатели;1998;415
Феодосьев;Алексей;Николаевич;День Поттер двух д’Эрбервиллей обитатели;1955;660
Старшинов;Николай;Валерьевич;Рождественская нашего времени;1859;932
Чинилов;Владислав;Геннадьевна;Обломов и терновнике не;1912;239
Батурин;Владислав;Андреевич;Божество Баскервилей и его;1907;826
Потемкин;Станислав;Алексеевна;Маленькие Парижской новый философский штурман;1996;271
Карухов;Артём;Константинович;Трое Шарлотты мукам Кубок;1850;879
Швырев;Илья;Григорьевич;Война оружию! подполья холеры;1951;636
Спирин;Марк;Васильевич;Трое или ума людях;1951;466
Гаянов;Даниил;Александрович;Роковая капитана и ржи огня;1904;497
Мансуров;Кира;Сергеевич;Драма Дун Мёртвого Кубок;1908;328
Лукашева;Георгий;Дмитриевич;Руслан пропастью Командир персик камень;1980;418
Бекетова;Элина;Александровна;Три сад наказание Прометей;1845;161
Романовский;София;Алексеевич;Маленькие из одиночества платяной;1858;804
Псурцев;Очир;Вячеславович;Анна охотника Пиквикского Том перемен;1865;186
Ефимов;Даниил;Рамильевич;Приключения Фаул фронте Том;1877;753
Селиванова;Виктория;Михайлович;Старик в бытия грядущего штурман;2003;814
Пена;Лада;Федорович;Ведьмы миров Оуэне;2005;432
Кудрявцева;София;Вячеславович;Обитатели человека фронте под;1893;900
Кирьянов;Артемий;Владимировна;Левша ветром наказание близ;1945;958
Санджиев;Николай;Георгиевич;Отец и Людмила Мезонинов шкаф;1955;281
Толмачева;Максим;Айдаровна;На и наказание дома штурман;1930;54
Словеснов;Дарья;Георгиевна;Преступление арка К;2015;342
Лукашева;Регина;Сергеевна;О или во ржи перемен;2021;925
Шестопалов;Сергей;Сергеевич;Доктор жнец лье не;1923;494
Алексанов;Очир;Бакытбековна;Левша Первый гигантский Том;1904;27
Егорова;Артем;Юрьевич;Гарри Поттер фронте д’Эрбервиллей;1867;944
Усманов;Наталия;Сергеевич;Отец Белкина Джонс Том обитатели;1860;635
Шевцев;Алексей;Рафиковна;Тэсс Белкина и философский;1841;116
Бескровная;Алексей;Анатольевна;Пляж Бульба море оружию!;1843;777
Бикушев;Магомед;Бакытбековна;Тарас юного и платяной;1975;547
Куулар;Арина;Алексеевна;Война во время августе;1910;27
Гребнев;Павел;Васильевна;Пятый рассказы и;2002;500
Померанцев;Мария;Андреевич;Тёмные Бриджит и тихие шкаф;1996;660
Васильева;Анастасия;Рамильевич;Двенадцать женщины любовники без Диканьки;1847;867
Козырева;Камилла;Георгиевич;Триумфальная Софии ума мир добрый;1984;81
Колесников;Алексей;Равкатовна;Винни стульев;1841;773
Бекетова;Алексей;Олеговна;Дракула Живаго и философский;1850;483
Андреев;Николай;Николаевич;По миля Смерти кукушки Азкабана;1840;334
Гусейнли;Андрей;Анатольевна;Мёртвые лет дети ржи;1934;117
Спирин;Юлия;Даниловна;Алхимик принц Оуэне и;1945;101
Зырянов;Таисия;Валерьевна;Рассказ Изумрудного допоздна мир;1847;947
Пучко;Иван;Вячеславович;Бедные пропастью Зеленых Том;1856;307
Бездольный;Михаил;Геннадьевна;Робинзон и границей Джонатан;2001;746
Харисова;Илья;Вячеславовна;Драма из и;1911;483
Пинаев;Вадим;Романович;1984 новости и Мини считая великан;1988;838
Олефир;Анастасия;Бакытбековна;Лорна западном охоте без;1939;589
Осипов;Никита;Денисович;Автостопом музыка Мёртвого близ;1952;441
Галкин;Андрей;Максимовна;Мир Софии и и;1992;144
Коряков;Полина;Владимировна;Записки ШКИД Современный фабрика;1840;988
Молодых;Михаил;Андреевна;Моби холмов Зеленых ржи;1848;124
Солдатов;Артем;Георгиевич;Тарас в Людмила чудес;1917;328
Нечаев;Дарья;Эдуардовна;Сто птиц Командир;1873;281
Старшинов;Егор;Андреевич;Имя из имени кукушки;1905;837
Зайнутдинова;Дарья;Эдуардовна;Гарри ШКИД галактике узник шкаф;1987;720
Батурин;Алиса;Игоревич;Повесть гнездо Юность людях;1991;981
Шлянов;Дарья;Вячеславович;Трое западном одиночества не перемен;2011;186
Антонов;Анна;Ильинична;Мартин западном мир без;1987;591
Девяткин;Максим;Максимовна;Аня Дун Гарпа;1927;837
Теслюк;Владислав;Руслановна;Эмма знамения охоте грядущего;1884;948
Васильев;Евгения;Владимирович;Приключения знамения терновнике и;2012;973
Амирханов;Александр;Руслановна;Дракула и мир его;1908;97
Рубайко;Галина;Сергеевич;Девчонки времени море;1913;938
Коште;Артём;Юрьевич;Живые Баскервилей Твиста;1912;714
Бескровная;Булат;Васильевич;Поющие Сергий Юность и Азкабана;1963;461
