Баринова;Роберт;Ильдарович;Воскресение над и городах Ливингстон;1954;581
Карухов;Иван;Александрович;Кавказский и города Кубок;1902;281
Андреев;Мирра;Даниловна;Подросток дивный Оуэне его обитатели;1906;951
Бекетова;Кристина;Михайлович;Чужестранка на шоколадная;1843;732
Новиков;Алексей;Андреевич;Три человека хуторе людях водой;2014;538
Шкляев;Софья;Александрович;Дети ночи, Твиста Фаренгейту;1916;471
Темурбекова;Екатерина;Иванович;Мотылёк холмов (В оружию!;1890;783
Олефир;Симон;Вячеславович;Невыносимая из от и;1845;256
Савченко;Мирра;Романович;Алиса по Большой грядущего обратно;1894;552
Гребенкин;Долума;Юрьевич;Детство. Бульба Джонс его обитатели;2001;770
Карухов;Артём;Александрович;Анна истины новый дома;1971;182
Зырянов;Михаил;Тимуровна;Большие и Зеленых его;1928;34
Быковский;Юрий;Витальевич;Чайка былого мир близ;1866;180
Грибкова;Георгий;Григорьевич;Сыновья Тома море;1964;366
Мансуров;Дария;Игоревич;О паруса Людмила Фаренгейту;1922;17
Пинаев;Полина;Ильдарович;В Копперфильд одиночества Том шкаф;1911;861
Шишкин;Павел;Александровна;День тьмы границей Джонатан огня;1913;469
Галиева;Кристина;Вячеславович;Джейн юного Холмса;1977;237
Галкин;Эльфат;Николаевич;Оно над подполья философский водой;1886;400
Чертова;Федор;Валерьевич;Левша и мукам его;1971;566
Игнатьев;Никита;Геннадьевна;Великий Стража! Богоматери;1919;577
Ефимов;Валерия;Максимович;Вечера Иден хуторе;1946;323
Романовский;Александр;Вячеславовна;Маленький элефант обочине под;1871;648
Теслюк;Никита;Марсовна;451 по Грея августе перемен великан;1954;677
Савченко;Анастасия;Эдуардовна;Пролетая элефант и мир;1939;521
Гребнев;Николай;Александровна;Сто нашего богом мир;2002;256
Иванова;Даниил;Максимович;Парфюмер дочка и фабрика;1931;60
Безель;Никита;Рафиковна;Два розы Большой кукушки;1976;887
Жмурин;Наталия;Владимирович;Паутина Годунов и колокол;1903;979
Черноиванова;Владислав;Максимовна;Мор, в границей персик Ливингстон;1930;342
Феодосьев;Валерия;Георгиевна;Собака гуляют море тихие;1960;522
Савельичев;София;Равкатовна;Пятый во Юность ржи шкаф;1919;867
Пчелинцев;Кристина;Тимуровна;Преступление Белкина Лис без;1870;414
Гусейнли;Лада;Евгеньевна;Приключения гнева допоздна Кубок перемен;1957;381
Словеснов;Ирина;Олегович;Лето Дориана Сойера мир;1872;860
Хайрутдинова;Дария;Дмитриевич;Великий Стража! звонит;1935;454
Кудрявцева;Лада;Николаевич;Дракула дивный гигантский персик;1893;950
Панов;Мария;Андреевич;Черный Поттер Маргарита;1925;305
Сабитов;Никита;Валерьевна;Пикник № одиночества рая;1905;103
Андреев;Владислав;Олеговна;Горе Первый гнездом;1991;320
Сильвентойнен;Анастасия;Ильдарович;К или Лис Фаренгейту;1985;597
Баринова;Николай;Ильсеярович;Записки Клык города Прометей Диканьки;2000;499
Баринов;Егор;Сергеевич;Гарри сестры одиночества узник;2020;588
Клянчин;Александр;Владимирович;Мэр на Маргарита колокол комната;1885;746
Пена;Элина;Александрович;Поющие Степанчиково 6 мир шкаф;1993;843
Николаев;Максим;Вячеславовна;Цветы дочка чердаке тихие;1988;472
Романовский;Юрий;Николаевич;Горменгаст былого и;1967;134
Мансуров;Лука;Александрович;Земля элефант границей тихие комната;1947;210
Игнатьев;Ясмина;Алексеевич;А в одиночества оружию! добрый;1843;120
Сабитов;Никита;Андреевич;Подросток из подполья кукушки шкаф;1845;749
Усманов;Владислав;Григорьевич;Граф Земли К Прометей;1858;871
Романовский;Эдуард;Георгиевна;Гарри из и под;1866;960
Пена;Никита;Викторовна;А колдунья Людмила рая;1907;925
Толмачева;Николай;Ришатович;Холодный сокровищ море Мезонинов штурман;1864;753
Фроловичев;Юлия;Иванович;Отверженные и терновнике тихие считая;2003;871
Шарова;Алиса;Борисович;Столпы розы и дома;1976;753
Алишерова;Лука;Алексеевич;Идиот Баскервилей обочине чудес;1921;202
Галкин;Данил;Алексеевна;1984 востоку Зеленых Фаренгейту перемен;1911;64
Прокопенко;Владислав;Дмитриевич;Роковая градус звонит колокол;1954;807
Словеснов;Наталия;Айдаровна;Волшебник Бриджит (В городах;1927;502
Садыхов;Илья;Альбертович;Король и богом Прометей обитатели;1913;248
Бездольный;Даня;Павлович;Сто № чердаке фабрика;1908;827
Баринова;Мария;Георгиевна;Республика Оливера Туда Мезонинов;1918;930
Харисова;Сергей;Михайлович;Записки колдунья Грея персик обитатели;1864;568
Сабитов;Валерия;Владимирович;Левша боги времени клуба Диканьки;1933;177
Милаева;Артем;Тимуровна;Повести № наказание и;1936;586
Усманов;Максим;Николаевич;Аня Поттер шоколадная философский перемен;1899;932
Коряков;Булат;Артемович;Сёгун и здесь Мезонинов;1864;168
Баринова;Арина;Геннадьевна;Доводы сокровищ Пиквикского платяной водой;2013;406
Лукашева;Антон;Александрович;Обломов розы Стране и;1900;930
Чертова;Елена;Николаевна;Обладать и гнездом холеры Азкабана;1884;978
Ткаченко;Александр;Ильинична;Мелкие Стража! Твиста тихие;1926;338
Бескровная;Вадим;Дмитриевич;Записки юного любовники персик;1943;979
Дьячкова;Ясмина;Станиславович;Повелитель паруса терновнике не штурман;1898;426
Осипов;Иван;Алексеевич;Лев, сердце море;1841;164
Собко;Александр;Гаряевич;О начала Богоматери фабрика;1862;292
Чертова;Павел;Рамильевич;Ярмарка Иден наказание августе;1878;559
Антонов;Павел;Владимирович;Собачье сестрички Пиквикского ржи обратно;1847;352
Лукашева;Роман;Андреевич;Ребекка Гэтсби и его штурман;2020;18
Шехтер;Сергей;Вячеславовна;Казаки и Грея платяной;2014;90
Феодосьев;Алиса;Алексеевич;Двенадцать Монте-Кристо гнездом оружию!;1973;175
Волох;Виктор;Сергеевна;Пятый Клык Людмила и;1853;522
Потемкин;Сергей;Алексеевна;Пляж и Оуэне кукушки перемен;1950;704
Коште;Алиса;Александрович;Приключения тщеславия время Кубок;1996;948
Бескровная;Дмитрий;Николаевич;Чарли или Юность;1886;315
Торжков;Анастасия;Ильдарович;Молитва и и Прометей;1926;107
Савельичев;Максим;Валерьевна;Посмертные Кэстербриджа дети августе;1943;27
Бекетова;Дарья;Николаевич;В Каренина дети городах штурман;1881;564
Батурин;Максим;Вячеславовна;Дядя по фронте колокол добрый;1983;367
Шагимарданова;Дарья;Николаевич;Волшебник Шарлотты Оуэне;1901;142
Блюм;Данил;Александровна;Рассказы Эйр море д’Эрбервиллей добрый;1968;876
Лилина;Виктор;Карамалиева;Ребекка Оливера галактике дома;1988;755
Панов;Ирина;Владимировна;Отверженные двор Финна философский считая;2013;707
Баринов;Елена;Ильдарович;Триумфальная стража здесь Мини;2007;896
Садофьев;Элина;Эдуардовна;Скотный мух и Мини;1908;517
Галиева;Никита;Денисович;Три колдунья море;1987;691
Чинилов;Даниил;Айдаровна;Рассказ былого и;1932;813
Земчик;Дарья;Юрьевич;Граф Монте-Кристо допоздна клуба;1900;765
Толмачева;Александр;Игоревич;Повести Эйр и кукушки Азкабана;1855;442
Бурцев;Виктор;Александровна;Мёртвые и дети Джонатан;1965;365
Панов;Александр;Александровна;Воскресение и море Мини;1888;543
Фроловичев;Данил;Олегович;1984 в К философский Диканьки;1974;698
Кузнецова;Артём;Юрьевич;Мор, Эйр шоколадная Фаренгейту комната;1993;579
Хайрутдинова;Михаил;Станиславович;Доктор юного Богоматери платяной;2010;982
Солдатов;Владислав;Сергеевич;451 Поттер подполья кукушки добрый;1957;410
Жмурин;Никита;Васильевич;1984 колец предубеждение кукушки;1861;366
Блюм;Дмитрий;Юрьевич;Унесённые колдунья двух Джонатан;1859;464
Чертова;Алексей;Рафиковна;Парфюмер на Джонс его;1866;916
Галкин;Федор;Алексеевич;Скотный и Маргарита и;1888;574
Шмелев;Никита;Владимирович;Отцы в врача чудес;1856;990
Солдатов;Ирина;Федорович;Записки дом новый грядущего камень;1902;661
Бурцев;Арина;Валерьевич;Убить гнева по Тайная;1846;836
Пена;Галина;Евгеньевна;Отверженные Эйр шоколадная без;1943;188
Гаянов;Марк;Андреевич;Рождественская и и оружию! водой;1957;894
Агашкина;Михаил;Петрович;Зеленая мух чердаке Том;1889;978
Хахарова;Анастасия;Александровна;Мрачный былого гигантский его;1858;566
Фроловичев;Юрий;Владимировна;Чайка товарища и тихие;1882;319
Торжков;Никита;Алексеевич;Скотный о и августе;1922;202
Исакова;София;Валерьевич;Граф № Людмила колокол;1898;598
Николаев;Алексей;Романович;Анна зори и без;1990;820
Садыхов;Валерия;Юрьевич;Лорна перевал хуторе чудес;1978;799
Игнатьев;Вадим;Алексеевич;Повести лет города;1898;943
Васильева;Никита;Николаевич;Автостопом Карамазовы гнездом клуба;1859;711
Нуртдинов;Никита;Разилевна;Мотылёк на богом;1845;838
Васильева;Игорь;Алексеевич;Драма градус фронте персик перемен;1920;618
Псурцев;Владимир;Батырович;Унесённые элефант и грядущего;2010;213
Васильева;Никита;Алексеевич;Медный тщеславия Брайдсхед его;1959;769
Феодосьев;Лада;Николаевич;Собака Шарлотты и ржи;1866;239
Лукашева;Анастасия;Игоревич;Благие и Твиста Кубок;1899;729
Базоева;Мирра;Михайлович;Маленький служанки Гарпа без;2014;870
Николаев;Станислав;Васильевич;Два лет Брайдсхед тихие;1941;30
Васильева;Даниил;Васильевич;Чужестранка Монте-Кристо терновнике кукушки;1856;122
Гаянов;Яков;Алексеевна;По ветром гнездом близ;1976;158
Амирханов;Андрей;Тамазович;Правда западном лье и;1953;644
Шкляев;Михаил;Дмитриевич;Хождение Стража! бытия Мезонинов Ливингстон;1913;766
Базоева;Алексей;Олегович;Кавказский оружию! и;1857;933
Аношин;Никита;Дмитриевич;Хайди на Пиквикского клуба 44-го);1968;194
Бурцев;Кристина;Алексеевич;Остров музыка дети дома;1991;939
Олефир;Василий;Вячеславович;Спокойной о гнездом платяной;1970;215
Попцова;Федор;Георгиевна;Гроздья по море без;1971;761
Савельичев;Гулабру;Дмитриевна;Пролетая начала мир людях;1927;850
Темурбекова;Очир;Игоревич;Американский отец Людмила не;2021;306
Васильев;Камилла;Александрович;Артемис миров Форсайтах не;1853;651
Гребнев;Анастасия;Бакытбековна;Портрет Оливера охоте людях 44-го);1896;960
Прокопенко;Михаил;Евгеньевна;Мемуары Шерлока Юность рая;1964;527
Бекетова;Евгения;Федорович;1984 жнец наказание Джонатан;1855;149
Масликов;Евгений;Александрович;Вещие надежды охоте;1879;254
Шевцев;Карам;Игоревич;Вечера сокровищ мертвые;1955;214
Никитина;Кира;Александрович;Чайка тщеславия шоколадная оружию!;1926;362
Копытин;Сергей;Николаевна;Волхв в море Прометей перемен;1998;544
Галкин;Артем;Дмитриевич;Маленький Степанчиково и без огня;1848;705
Минубаев;Павел;Дмитриевич;Цвет пленник рода;1957;276
Пучко;Яна;Талантбековна;Рудин паруса Джонс колокол;1848;916
Толмачева;Елена;Александровна;Осиная тщеславия Холмса городах;1950;938
Таранченко;Дарья;Вячеславович;День Пух время оружию!;1861;762
Колесников;Марк;Георгиевна;Роковая тьмы Богоматери;1966;535
Нечаев;Дарья;Федорович;На сад мир;1960;293
Нечаев;Даниил;Сергеевна;Противостояние № Большой не;1938;546
Егорова;Полина;Андреевич;Три из подполья Кубок считая;1923;722
Сильвентойнен;Никита;Андреевич;Оно Поттер К чудес;1841;76
Баринова;Андрей;Алексеевич;Мартин и времени его;1864;630
Гридасов;Никита;Максимовна;Пиковая Бриджит богом Прометей;1956;936
Зырянов;Эльдар;Владимирович;Горе Иден Командир персик добрый;1858;770
Черепанова;Илья;Георгиевна;Трое морей: и грядущего;1990;332
Грибкова;Дмитрий;Михайлович;Старик сердце имени грядущего перемен;1871;464
Сабитов;Никита;Анатольевна;Золотой и наказание и;1934;476
Батурин;Бегимай;Вагабович;Кавказский или фронте и;1899;946
Селиванова;Максим;Сергеевич;Лев, пересмешника Туда персик;1928;306
Грибкова;Полина;Дмитриевич;Роковая рассказы любовники;1914;177
Шлянов;Егор;Олегович;Эмма западном охоте колокол;1986;843
Блюм;Карам;Романович;Старик сердце Зеленых его;1896;994
Молодых;Екатерина;Игоревич;Кавказский об допоздна Мезонинов;1993;606
Молодых;Валерия;Юрьевич;Девчонки и (В рая;1938;423
Грибкова;Дмитрий;Артемович;БДВ, в лодке, рая;1974;639
Селиванова;Никита;Валерьевич;Бег колдунья море тихие Азкабана;1872;707
Бекетова;Илья;Олеговна;Лето отец и мир;1867;944
Дегтярев;Бегимай;Викторовна;Казаки Тома море рая обитатели;1880;104
Черноиванова;Сергей;Александровна;Черный человека К Кубок;1864;345
Копытин;Валерия;Сергеевич;Доводы сад одиночества Том шкаф;1976;412
Панов;Вадим;Сергеевич;Уловка-22 или Юность философский;1856;379
Девяткин;Григорий;Сергеевна;Пятый из терновнике;1908;29
Зырянов;Никита;Владимирович;Повести теленок гигантский Мини;1871;890
Шишкин;Юрий;Бакытбековна;Возвращение Крузо Смерти августе;1962;724
Рубайко;Мария;Игоревна;Лев, и Брайдсхед;1897;609
Колесников;Айдана;Гумаровна;Эмма Дун К оружию!;1904;384
Галиева;Юрий;Андреевич;Аня тьмы гнездом его;2018;585
Марков;Илья;Алексеевна;Алиса начала Маргарита;1925;338
Быковский;Николай;Вячеславовна;Волхв ученик фронте дома комната;1981;61
Таранченко;Андрей;Николаевич;Сто дивный имени;1899;786
Солдатов;Камилла;Тимуровна;Собачье в оскорблённые;1913;960
Базоева;Виктор;Петрович;Мир записки границей дома;1863;248
Васильева;Софья;Руслановна;Детство. нашего допоздна без;1882;658
Зайнутдинова;Евгения;Даниловна;Руслан и (В августе;1920;680
Молодых;Георгий;Дмитриевич;Стража! сад и;2011;398
Любимов;Дмитрий;Андреевич;Мартин реки границей;2013;634
Пена;Дмитрий;Намигович;Уловка-22 ветром мистер без комната;1859;556
Коште;Эдуард;Сергеевич;Ревизор рассудка предубеждение и;1978;283
Шишкин;Елена;Рафиковна;А Гэтсби Пиквикского клуба 44-го);1873;85
Люкшин;Александр;Валерьевич;Граф в Грея Кубок;1970;486
Хахарова;Игорь;Даниловна;Джейн тысяч богом кукушки;1963;673
Кузнецова;Николай;Эльханович;Анна принц одиночества его;1851;244
Шмелев;Софья;Георгиевна;Сёгун по подполья под;1967;323
Перетятько;Мария;Григорьевич;Три новости мир Том;1965;514
Васильев;Алексей;Гаряевич;Дневник волшебства Лис Тайная;1891;933
Куулар;Булат;Александрович;Дядя и допоздна грядущего;1966;610
Копытин;София;Гаряевич;Записки из шоколадная;1934;63
Кузнецова;Анна;Гумаровна;Лев, музыка Командир и перемен;1906;349
Васильев;Никита;Дмитриевич;Золотой тысяч ивах чудес добрый;1877;568
Дьячкова;Элина;Витальевич;К за рода и;1958;509
Коште;Дамир;Артемович;Убить капитана Сойера под;1903;396
Джинчарадзе;Бегимай;Максимовна;А волшебства Современный людях водой;1928;925
Перетятько;Михаил;Станиславович;Пролетая лёгкость мертвые и;1870;206
Исакова;Антон;Алексеевич;Маленькие лёгкость мир платяной добрый;1967;135
Зубенок;Виталий;Алексеевич;Волшебник Санникова и рая;1973;571
Сорокин;Карам;Андреевич;Над по Холмса мир;1840;788
Немна;Арина;Васильевич;Подросток Ваня мистер;1907;286
Егорова;Мирра;Владимирович;1984 Онегин оскорблённые;1847;738
Кузнецова;Григорий;Ильсеярович;Два от Людмила и;2021;235
Немна;Алиса;Ильсеярович;Левша быть подполья грядущего;1860;700
Сабитов;Долума;Валерьевич;Крестный и Брайдсхед;1896;613
Черепанова;Игорь;Даниловна;На мушкетера наказание д’Эрбервиллей;1898;537
Мансуров;Николай;Иванович;Таинственный Санникова во городах водой;1907;781
Ефимов;Алексей;Георгиевна;Гроздья холмов одиночества августе;1860;96
Марков;Павел;Карамалиева;Пётр Крузо рода Мезонинов Диканьки;1868;956
Харисова;Юлия;Валерьевич;Повесть двор и и добрый;1863;532
Савченко;Анна;Андреевна;Игрок об от Тайная;1957;840
Блюм;Регина;Ильинична;Ревизор и мир и;1911;125
Чернов;Анна;Альбертович;В музыка К философский штурман;1868;445
Масликов;Дмитрий;Дмитриевна;Хозяин Гэтсби и кукушки камень;1994;844
Хмелев;Дмитрий;Николаевич;Преступление Монте-Кристо Лис Мини;1923;324
Феодосьев;Павел;Георгиевич;Цвет Каренина подполья городах перемен;1945;724
Жмурин;Виктор;Алексеевна;Село товарища Богоматери августе;1882;944
Марков;Дарья;Витальевич;Чайка или Богоматери Мезонинов перемен;1909;786
Шагимарданова;Лука;Гаряевич;Зеленая Тома и Джонатан Диканьки великан;1938;853
Куликова;Булат;Игоревич;Дубровский служанки Лис колокол;1931;928
