Баринов;Максим;Иванович;Чайка Шерлока здесь Прометей штурман великан;2010;356
Вирютин;Софья;Сергеевич;Герой из лодке, Том;1865;498
Швырев;Долума;Георгиевна;Пролетая Парижской Маргарита;1861;662
Осипов;Дарья;Гумаровна;Корабельные и имени ржи комната;1924;61
Селиванова;Вадим;Михайлович;Тэсс и рода под обратно;2013;834
Бурцев;Георгий;Михайлович;Правда и ивах без перемен;1937;49
Хахарова;Максим;Талантбековна;Дэвид психопат чердаке фабрика;1914;388
Васильев;Дмитрий;Гаряевич;Хоббит, Иден охоте кукушки Диканьки;1956;317
Коряков;Никита;Руслановна;Братья градус мир ржи;1858;997
Перетятько;Елена;Дмитриевич;Севастопольские знамения врача Фаренгейту;1981;535
Пинаев;Софья;Тамазович;Чужестранка или Пиквикского не водой;2018;721
Чертова;Артём;Дмитриевич;Записки Белкина Форсайтах городах;1977;383
Андреев;Камилла;Дмитриевна;Анна Монте-Кристо Людмила городах;2002;88
Гребнев;Дмитрий;Борисович;Изумительный миля города Джонатан;1933;975
Таранченко;Иван;Георгиевич;Алые над Людмила чудес;1925;161
Петров;Яков;Дмитриевич;Рассказы рассудка подполья;1869;381
Швырев;Магомед;Андреевич;Волхв ветром подполья;1997;666
Лукашева;Эльфат;Карамалиева;Правда Шакала терновнике Тайная;1872;85
Зубенок;Гордей;Олеговна;Автостопом Степанчиково звонит грядущего Ливингстон;1929;942
Бикушев;Алексей;Евгеньевна;Хаджи-Мурат Монте-Кристо и ржи Ливингстон;1857;683
Сайфуллина;Сергей;Владимирович;Тёмные Каренина лье д’Эрбервиллей Азкабана;1962;489
Гребнев;Елена;Георгиевна;Приключения № Мёртвого Мезонинов;1888;167
Антонов;Артём;Андреевна;Пляж Дун время Тайная;1995;236
Прокопенко;Юлия;Тамазович;Три Бульба и оружию! добрый;1964;641
Любимов;Виктория;Сергеевич;Старик Софии Сойера грядущего обитатели;2000;225
Нуртдинов;Артем;Алексеевна;К паруса во Кубок добрый;1969;108
Шпак;Георгий;Хусниддиновна;Три и мир не;2006;676
Волох;Илья;Равкатовна;На Степанчиково Оуэне;1948;790
Галиева;Никита;Марсовна;Ревизор ночи, Холмса оружию! Диканьки;1928;650
Копытин;Лука;Вячеславовна;Холодный фабрика двух августе Диканьки;1841;107
Шкляев;Валерия;Максимовна;Мёртвые ночи, и августе перемен великан;1983;916
Любимов;Элина;Денисович;Гарри Шакала допоздна близ;1848;572
Андреев;Валерия;Александровна;Ветер волшебства Богоматери дома камень собаки;1927;42
Перетятько;Камилла;Георгиевич;Приключения из шоколадная городах перемен;1929;576
Галиева;Эльфат;Дмитриевич;Живые Васильевич терновнике не;1958;415
Старшинов;Дмитрий;Тамазович;Вор души и ржи;1870;18
Жмурин;Софья;Николаевна;Джеймс из;1925;544
Аношин;Таисия;Гаряевич;Властелин во чердаке фабрика добрый;2020;858
Шпак;Никита;Михайлович;Идиот Фаул звонит колокол;1886;233
Немна;Дамир;Александрович;Таинственный Отрочество. и Том;1975;88
Потемкин;Роман;Олеговна;1984 в Зеленых Фаренгейту шкаф;1975;806
Базоева;Максим;Гумаровна;Американский перевал границей холеры;1917;148
Гаянов;Егор;Станиславовна;Записки и двух мир;1869;911
Быковский;Илья;Дмитриевна;Сто или Брайдсхед не;1919;414
Хмелев;Данил;Ришатович;Мир и оскорблённые без обитатели;1919;833
Андреев;Александр;Владимировна;Маленький лёгкость Грея под;1865;979
Чертова;Николай;Константинович;Мир капитана галактике и;1930;212
Кобякова;Кирилл;Равкатовна;Рудин в и клуба;1892;32
Люкшин;Егор;Андреевич;Бедные мистер Гарпа грядущего;1932;93
Дегтярев;Василий;Михайловна;День от одиночества холеры перемен;1905;516
Кузнецова;Елена;Тимуровна;Алиса колдунья здесь;1946;992
Чернов;Алексей;Георгиевич;На в предубеждение под;1929;256
Пена;Георгий;Павлович;На Фаул Сойера персик;1929;399
Потемкин;Александр;Алексеевич;Гарри о Туда философский обитатели собаки;1869;269
Хахарова;Даниэлла;Михайлович;451 глазами Богоматери;1868;263
Пена;Роман;Витальевич;Алхимик Иден мукам Мини Диканьки;2003;270
Козырева;Никита;Максимовна;Дракула градус одиночества и;1897;339
Алишерова;Даня;Хусниддиновна;Приключения и Юность не;1959;481
Клянчин;Екатерина;Андреевна;Джейн розы гнездом Прометей;1996;46
Нуртдинов;Мирра;Александрович;Судьба по гнездом оружию!;1902;658
Дегтярев;Валерия;Алексеевна;Любовь мистер звонит августе;1941;282
Алишерова;Бегимай;Васильевич;Рождественская юного Современный людях;1970;770
Кирьянов;Алексей;Николаевич;Анна в оскорблённые;1939;111
Олефир;Георгий;Владимирович;Анна дом обочине Мини;1842;238
Черепанова;Долума;Николаевич;Ветер Софии море августе огня;1982;307
Шевцев;Виктор;Андреевич;О истины фронте холеры Азкабана;1895;47
Антонов;Дарья;Алексеевич;Судьба Баскервилей гнездом холеры;1882;882
Шишкин;Малик;Вадимович;Грозовой и гигантский Фаренгейту;2019;19
Грибкова;Эльдар;Александровна;Повелитель Незаметный море чудес;1968;329
Галиева;София;Александрович;Мастер Кэстербриджа Брайдсхед персик перемен;1914;18
Шарова;Анна;Андреевич;Пролетая быть и ржи;1860;959
Борисова;Регина;Витальевич;Борис по мертвые платяной шкаф;1882;142
Гридасов;Дарья;Алексеевич;Братья мистер Богоматери ржи;1859;680
Дегтярев;Роберт;Николаевна;Гарри Дик обочине Тайная шкаф;1965;196
Быковский;Игорь;Талантбековна;Старик над Зеленых Прометей;1856;429
Балинова;Виктория;Андреевна;Божество тьмы двух и;1917;323
Молодых;Даниил;Валерьевна;Преступление Бриджит Лис Мезонинов;1852;616
Таранченко;Федор;Александрович;Белая из и мир;1930;509
Чертова;Георгий;Валерьевич;Повести гнездо Зеленых;1979;296
Салдусов;Егор;Александровна;Обломов всадник Грея ржи Ливингстон собаки;1844;490
Кирьянов;Виктория;Равкатовна;Преступление полуночи подполья августе водой;1907;133
Быковский;Гулабру;Денисович;Горменгаст Бульба наказание и;1968;418
Александров;Дмитрий;Эдуардовна;Пиковая Отрочество. дети грядущего добрый;2005;156
Васильев;Роберт;Батырович;Артемис Софии обочине Прометей;2002;446
Жмурин;Глеб;Валерьевич;К начала наказание оружию!;2019;158
Шпак;Булат;Станиславович;К Поттер Современный под;1910;698
Копытин;Кира;Евгеньевна;Холодный Оливера от мир обитатели;2017;938
Гусейнли;Кирилл;Владимирович;Записки служанки море платяной огня;2020;892
Перетятько;Никита;Игоревич;Пролетая Фаул терновнике холеры;1984;577
Галиева;Михаил;Олегович;Вечера мышах Маргарита философский;1961;582
Шагимарданова;Эдуард;Александровна;Воскресение Санникова Мёртвого Фаренгейту;1883;843
Васильева;Анна;Валерьевич;Крестный и во Том перемен;1875;51
Нуртдинов;Алексей;Сергеевна;Казаки гнева Маргарита узник шкаф;1840;331
Грибкова;Никита;Михайлович;Анна тысяч и чудес Ливингстон;1992;798
Нуртдинов;Андрей;Николаевич;Записки волшебства и;1851;962
Лукашева;Александр;Дмитриевич;Золотой об Холмса и;1852;473
Васильев;Карам;Игоревич;Гроздья охотника подполья философский;1864;511
Черепанова;Гордей;Олегович;Сёгун Бриджит Зеленых персик 44-го);1848;531
Хмелев;Александр;Ильинична;Село по Твиста узник;1899;941
Шишкин;Артемий;Николаевич;Преступление арка и платяной огня;1985;679
Муханов;Регина;Александрович;Поющие Дон Холмса оружию!;2009;544
Игнатьев;Илья;Владимирович;Три Монте-Кристо Туда дома огня;1871;434
Кузнецова;Илья;Валерьевна;Маленький Белкина Смерти клуба;1925;982
Кобякова;Даниил;Иванович;Холодный арка наказание;1889;673
Торжков;Георгий;Олегович;Столпы теленок Маргарита персик перемен;1905;692
Щербаченко;Айдана;Вячеславович;Хоббит, Бульба и без;1897;502
Хахарова;Артем;Максимович;Земля рассудка фронте д’Эрбервиллей считая;1903;677
Таранченко;Николай;Викторовна;Рассказ арка бытия грядущего перемен;2002;439
Никитин;Вадим;Гумаровна;Повести Онегин чердаке его считая;1840;645
Батурин;Полина;Михайловна;Двенадцать принц гнездом и;1975;977
Глазачев;Роберт;Владимирович;Хозяин Шарлотты Зеленых ржи обитатели;1987;924
Собко;Анастасия;Алексеевич;БДВ, миров Лис городах;1974;820
Торжков;Кристина;Рамильевич;Стража! Сергий города мир водой;1945;569
Алексанов;Игорь;Олеговна;Война триффидов и Фаренгейту;1847;642
Пена;Элеонора;Васильевич;Преступление Гекльберри богом и;1901;954
Ефимов;Лада;Станиславовна;Остров от шоколадная Прометей;1892;293
Андреев;Марк;Васильевич;Американский Эйр и;1870;741
Земчик;Георгий;Хусниддиновна;Эмма в К холеры;1966;595
Усманов;Алексей;Максимовна;Артемис и предубеждение людях огня;1903;128
Солдатов;Данил;Олегович;Горменгаст двор терновнике холеры;1962;845
Ткаченко;Дмитрий;Васильевич;Над Дун богом колокол обитатели;1900;835
Черепанова;Дмитрий;Станиславович;Преступление Незаметный и клуба комната;1975;693
Масликов;Анна;Михайлович;Дворянское Софии времени колокол штурман;2013;581
Иванова;Алмаз;Алексеевич;Обитатели и море ржи;1945;868
Баринова;Глеб;Александровна;Властелин из Современный и водой;1950;483
Нуртдинов;Александр;Сергеевна;Старик на оскорблённые Прометей камень;1885;152
Бескровная;Андрей;Вячеславович;О теленок;1990;808
Собко;Валерия;Александровна;Противостояние времени Пиквикского Кубок водой;1887;757
Савельичев;Лука;Андреевич;Воскресение Дик и рая;1854;340
Грибкова;Иван;Вячеславовна;Вишневый дороге и Тайная шкаф;1906;628
Коште;Анна;Владимирович;Доводы и галактике платяной;2020;743
Бикушев;Алексей;Иванович;Джуд и Сойера людях Азкабана;1841;180
Николаев;Артем;Рафиковна;В птиц и узник Диканьки;1952;582
Олефир;Долума;Марсовна;Сыновья миля дети холеры;1952;523
Джинчарадзе;Георгий;Анатольевна;Дэвид от богом людях перемен;1873;454
Иванова;Софья;Дмитриевич;Драма нашего Твиста;2000;814
Нуртдинов;Николай;Карамалиева;Мастер сокровищ границей фабрика перемен;1905;678
Бурцев;Валерия;Владимировна;Франкенштейн, и время;2021;283
Амирханов;Бегимай;Гаряевич;Золотой об Юность городах перемен;1974;695
Осипов;Регина;Александрович;Ведьмы за (В Джонатан;1927;605
Агашкина;Александр;Айдаровна;Маленький игле врача Фаренгейту;1941;251
Старшинов;Ангелина;Федорович;Сто капитана богом ржи Азкабана;1859;682
Игнатьев;Дарья;Борисович;Винни принц и д’Эрбервиллей;1984;362
Нуртдинов;Анна;Анатольевна;Борис Копперфильд и холеры;1912;820
Амирханов;Глеб;Марсовна;Пролетая западном врача персик 44-го);1864;77
Хмелев;София;Евгеньевна;Посмертные востоку гигантский мир огня;1951;173
Строкин;Андрей;Вагабович;Граф обелиск и людях;1963;912
Теслюк;Магомед;Георгиевна;Пролетая гнева новый Тайная;1983;608
Садофьев;Лука;Дмитриевич;Анна Дориана по;1879;722
Колесников;Юлия;Равкатовна;Спокойной жнец и чудес огня;1865;641
Романовский;Арина;Михайлович;Чужестранка колдунья Оуэне и огня;1880;147
Галиева;Даниил;Юрьевич;Севастопольские сад гнездом холеры;1934;644
Романовский;Виталий;Сергеевна;Доводы Дик хуторе;1995;788
Шарова;Владислав;Олеговна;Старик розы К;1965;751
Попцова;Валерия;Павлович;Властелин женщины города персик;1891;481
Попцова;Иван;Александровна;Hi-Fi и от людях комната собаки;1961;895
Пена;Евгений;Ильинична;Убить и (В ржи перемен;1879;575
Куулар;Юрий;Вячеславовна;Фауст принц ивах без;1853;594
Шлянов;Яков;Константинович;Дракула тьмы Холмса рая;1951;983
Немна;Александр;Максимович;Чужестранка колец времени дома;1936;422
Прокшин;Арина;Евгеньевна;К или от Фаренгейту;1970;803
Словеснов;Егор;Романович;Лолита Первый терновнике;2018;842
Агашкина;Иван;Викторовна;Возвращение в Холмса Тайная;1887;235
Шевцев;Марк;Михайлович;Хоббит, мушкетера Пиквикского августе;2011;560
Шарова;Анастасия;Николаевич;Большие во Твиста Мини шкаф;1921;278
Феодосьев;Даниил;Николаевич;Белый пересмешника мистер и;1889;389
Исакова;Элина;Николаевна;Ярмарка по обочине и штурман;1857;632
Щербаченко;Лада;Сергеевич;Пение Эйр лодке, Тайная камень;1999;406
Шехтер;Георгий;Вагабович;На пленник Пиквикского;1900;950
Лобань;Мария;Дмитриевна;Грозовой двор мир д’Эрбервиллей;1905;852
Никитин;Дмитрий;Вячеславович;Три или новый холеры;1946;359
Лукашева;Игорь;Игоревич;Возвращение лет города платяной;1944;761
Строкин;Алексей;Талантбековна;Три Дик гигантский клуба обитатели;1980;528
Таранченко;Андрей;Рафиковна;Пение стульев бытия персик Азкабана;2006;421
Андреев;Лада;Николаевич;Столпы жнец ивах холеры добрый;1947;781
Гридасов;София;Дмитриевна;Правда сердце К;2008;158
Гридасов;Дарья;Олегович;Вишневый мистер море и;1912;354
Никитин;Анастасия;Михайловна;Униженные сестры предубеждение кукушки камень;2002;622
Нуртдинов;Владислав;Алексеевна;Невыносимая дороге Маргарита холеры;1991;606
Садофьев;Николай;Витальевич;Бедные лёгкость мертвые;1848;821
Прокопенко;Георгий;Юрьевич;Солярис Гекльберри допоздна;2006;49
Молодых;Павел;Исламовна;Мастер сестрички дети его Азкабана;1922;395
Грибкова;Алиса;Андреевич;Рассказ Отрочество. (В Прометей комната;1981;911
Зубенок;Артем;Станиславович;Капитанская стульев Твиста Том перемен;1900;165
Феодосьев;Ангелина;Михайлович;Подросток обелиск и платяной;1964;343
Алексанов;Юлия;Максимовна;Большие принц дети ржи;1951;948
Марков;Юлия;Евгеньевна;Собака мух дети платяной огня;1925;385
Васильева;Арина;Олегович;Отец гнева наказание Мезонинов;1976;726
Аношин;Симон;Юрьевич;Сердце и хуторе;1878;85
Шлянов;Лука;Ильинична;Пётр триффидов и фабрика;1944;487
Немна;Андрей;Алексеевна;Сто миров здесь фабрика;1854;759
Попцова;Павел;Алексеевич;Ветер сад и платяной перемен;2021;752
Спирин;Владислав;Сергеевич;Таинственный игле Богоматери чудес;1890;843
Сильвентойнен;Элеонора;Вадимович;Повесть и любовники кукушки перемен;1959;831
Шкляев;Павел;Денисович;Игрок пленник дети кукушки;1857;504
Москаленко;Илья;Тимуровна;Пролетая Каренина Пиквикского близ;1927;346
Дьячкова;Илья;Равкатовна;Гарри Монте-Кристо гнездом;1869;312
Прокопенко;Булат;Дмитриевна;Девчонки женщины по кукушки шкаф;1935;412
Пучко;София;Михайловна;Тихий начала Командир рая штурман;1993;342
Никитина;Юлия;Витальевич;День или Джонс Джонатан Ливингстон;1872;827
Петров;Александр;Вагабович;Ведьмы жнец чердаке узник водой;1857;35
Быковский;Магомед;Алексеевна;Доводы западном границей;1956;914
Рубайко;Гулабру;Альбертович;Чайка пленник хуторе фабрика Азкабана;1913;276
Чертова;Алексей;Валерьевич;Винни и Брайдсхед;1930;495
Джинчарадзе;Елена;Григорьевич;Девчонки о Богоматери близ;1920;634
Масликов;Валерия;Константинович;Собачье элефант 6 его Ливингстон;1976;482
Шехтер;Лука;Сергеевич;Стража! Пух 6 кукушки;1927;573
Потемкин;Кира;Алексеевич;Маленький и одиночества холеры камень;1868;341
Ефимов;Сергей;Сергеевна;Земля и города близ штурман;1910;247
Власенко;Вадим;Васильевич;Горменгаст принц Современный Мезонинов;1969;143
Москаленко;Иван;Талантбековна;Иван миров дети;1927;283
Померанцев;Алиса;Александрович;День Степанчиково города кукушки;2015;40
Тихонов;Марк;Михайлович;Повелитель принц по под;1942;707
Копытин;Даня;Тимуровна;Винни женщины одиночества колокол;1860;924
Швырев;Дмитрий;Тимуровна;Маленькие по здесь;1971;31
Швырев;Артемий;Александрович;Скотный в и Кубок;1890;843
Борисова;Юлия;Вячеславович;Властелин Иден новый кукушки;1894;713
Чинилов;Галина;Александровна;Анна глазами и платяной огня;1926;942
Хахарова;Булат;Владимировна;Дневник тысяч Зеленых тихие огня;2020;590
Копытин;Арина;Павлович;Рождественская Степанчиково Зеленых Мини комната;2011;745
Бикушев;Артём;Николаевич;Записки пропастью времени Прометей;1943;760
Дегтярев;Дарья;Альбертович;Портрет быть границей Джонатан;1858;136
Клянчин;Мария;Дмитриевна;Скотный мышах Пиквикского кукушки;2005;881
Грибкова;Андрей;Тамазович;День Незаметный лодке, д’Эрбервиллей шкаф;1888;820
Люкшин;Магомед;Игоревич;Преступление сад границей персик;2016;123
Шарова;Михаил;Романович;Воскресение ШКИД Богоматери Мини;1953;810
Шмелев;Даниил;Анатольевна;По сад чердаке холеры;1971;333
